clause_text,rating
"10.8 PPI Liability Limitation. Any and all liability of PPI to EKR howsoever arising in respect of this Agreement, the Transition Services and Inventory Agreement or the Supply Agreement and their performance, in contract tort or otherwise, shall be limited (except for death or personal injury caused by the negligence of PPI or its employees while acting in the course of their employment) to  US Dollars ($); provided however that such limitation shall not apply to the extent that EKR or any EKR Indemnified Party is required to pay in excess of such amount to a third party in respect of a final judgment or order obtained by the third party or as a result of PPI's breach of Section 7.2.12 of the Supply Agreement. 10.9 EKR Liability Limitation. Any and all liability of EKR to PPI howsoever arising in respect of this Agreement, the Transition Services and Inventory Agreement or the Supply Agreement and their performance in contract tort or otherwise shall be limited (except for death or personal injury caused by the negligence of EKR or its employees while acting in the course of their employment, and except in relation to any specified payment, lump sum, milestone or royalty payment unpaid) to  US Dollars ($); provided however that such limitation shall not apply to the extent that PPI or any PPI Indemnified Party is required to pay in excess of such amount to a third party in respect of a final judgment or order obtained by the third party. 10.10 Limitation of Damages. Notwithstanding anything contained in this Agreement or the Transition Services and Inventory Agreement or the Supply Agreement in no circumstance shall either Party be liable to the other in contract, tort (including negligence or breach of statutory duty) or otherwise howsoever, and whatever the cause thereof, for any special, indirect or consequential loss or damage of any nature whatsoever except in the cases of fraud or intentional misconduct or in the case of PPI as a result of PPI's breach of Section 7.2.12 of the Supply Agreement.",2.0
"5 Confidential Information. omitted 7 Indemnification and Insurance. 7.1 omitted 9 Limitation of Liability. 9.1 The maximum liability of one Party to the other Party and its affiliates in relation to this Agreement will be  (Liability Cap), provided however that: 9.1.1 The Liability Cap will not apply to any (1) material confidentiality breach under Section 5, and/or (2) indemnification obligations under Section 7.1. 9.1.2 The Liability Cap will not apply to intentional misconduct and/or gross negligence. 9.2 For the purpose of this Section, liability means liability for any and all claims, causes of action, judgments, costs and expenses (including but not limited to reasonable attorney fees and expenses), reimbursements, losses, and any and all other liabilities and damages of any kind, whether in contract, tort (including negligence), equity, statute or otherwise arising out of, in relation to or as a result of this Agreement.",2.0
"15. Infringement. WGT will defend and indemnify Distributor against any judicial proceeding based upon infringement of any U.S. patent or US. copyright by the Product to the extent that such proceeding arises from or in connection with a component of the Product manufactured or developed by WGT and not any third party, provided that Distributor notifies WGT of such proceeding promptly after Distributor receives notice thereof, WGT has control over the defense and settlement of the proceeding, Distributor provides such assistance in the defense and settlement of the proceeding as WGT may reasonably request, and Distributor complies with any settlement or court order made in connection with such proceeding (e.g., as to the future use of any infringing Product). WGT's obligations under this paragraph will not apply to any infringement to the extent arising out of any use or combination of the Product with any other products, goods, services or other items furnished by Distributor or anyone other than WGT or to any modification or change of the Product not made by WGT. 18. Limitations of Liability. EXCEPT AS PROVIDED IN PARAGRAPH 15, WGT'S LIABILITY(WHETHER IN CONTRACT, WARRANTY, TORT (INCLUDING NEGLIGENCE WHETHER ACTIVE, PASSIVE, IMPUTED), PRODUCT LIABILITY, STRICT LIABILITY OR OTHER THEORY) UNDER THIS AGREEMENT OR WITH REGARD TO ANY PRODUCT OR OTHER ITEMS FURNISHED UNDER THIS AGREEMENT WILL IN NO EVENT EXCEED THE COMPENSATION PAID TO WGT CONCERNING SUCH PRODUCT UNDER THIS AGREEMENT.",2.0
"12.3 No Liability for Consequential Damages. No party will be liable to any other for any indirect, consequential, or special damages or for loss of profits. This limitation does not, however, apply to any obligation of either party to indemnify the other in connection with any Indemnifiable Loss. 12.4 Limitation on Liability. Notwithstanding any other provision contained in this Agreement, each party's maximum aggregate liability to the other party for any and all causes whatsoever, and each party's remedy, regardless of the form of action, whether in contract or tort, including negligence, and whether or not pursuant to the indemnification provisions contained in Section 12 and whether or not such party is notified of the possibility of damage to the other party, shall be limited to $  .",2.0
"4.2 PRODUCT INDEMNITY. PivX will indemnify, defend and hold Detto and its subsidiaries (each, an Indemnified Party), harmless from and against any and all claims, losses, costs, liabilities and expenses (including reasonable attorneys' fees), arising as a result of or in connection with any claim that Qwik-Fix Pro or Documentation infringes any intellectual property right of a third party provided: (i) the Indemnified Party promptly gives written notice of any claim to PivX; (ii) the Indemnified Party provides any assistance which PivX may reasonably request for the defense of the claim (with reasonable out of pocket expenses paid by PivX); and (iii) PivX has the right to control of the defense or settlement of the claim, provided, however, that the Indemnified Party shall have the right to participate in, but not control, any litigation for which indemnification is sought with counsel of its own choosing, at its own expense. Additionally, if an injunction or order issues restricting the use or distribution of any of Qwik-Fix Pro or Documentation, or if PivX determines that Qwik-Fix Pro or Documentation are likely to become the subject of a claim of infringement or violation of any proprietary right of any third party, PivX shall in its discretion and, at its option (a) procure the right to continue using, reproducing, and distributing Qwik-Fix Pro and Documentation; (b) replace or modify Qwik-Fix Pro and Documentation so that they become noninfringing, provided such modification or replacement does not materially alter or affect the specifications for or the use or operation of Qwik-Fix Pro; require return of Qwik-Fix Pro to PivX and refund any licensing fees relating to the future use of Qwik-Fix Pro. omitted 4.4 INDEMNIFICATION. Detto shall indemnify and hold PivX harmless from and against any and all damages, liabilities, costs and expenses (including reasonable attorney's fees) which PivX incurs as a result of any claim based on any breach of any representation or warranty, covenant or agreement by Detto under this Agreement or any breach of this Agreement by Detto; provided: (i) that PivX promptly gives written notice of any claim to Detto; (ii) at Detto's expense, PivX provides reasonable assistance which Detto may reasonably request for the defense of the claim; and (iii) Detto has the right to control the defense or settlement of the claim, provided, however, that PivX shall have the right to participate in, but not control, any litigation for which indemnification is sought with counsel of its own choosing, at its own expense. 4.3 LIMITATION OF LIABILITY. EXCEPT FOR PIVX'S OBLIGATIONS UNDER SECTION 4.2, IN NO EVENT SHALL PIVX'S OR ITS LICENSORS' LIABILITY TO DETTO OR ANY THIRD PARTY ARISING OUT OF THIS AGREEMENT EXCEED THE TOTAL AMOUNT ACTUALLY RECEIVED BY PIVX HEREUNDER DURING THE PREVIOUS SIX (6) MONTHS. IN NO EVENT SHALL ANY PARTY OR PIVX'S LICENSORS BE LIABLE TO ANOTHER PARTY OR ANY THIRD PARTY FOR LOSS OF DATA, COSTS OF PROCUREMENTS OF SUBSTITUTE GOODS OR SERVICES OR ANY INDIRECT, INCIDENTAL, SPECIAL, OR CONSEQUENTIAL DAMAGES UNDER ANY CAUSE OF ACTION, EVEN IF SUCH PARTY HAS BEEN ADVISED OF THE POSSIBILITY OF SUCH DAMAGES. THIS LIMITATION SHALL APPLY NOTWITHSTANDING ANY FAILURE OF AN ESSENTIAL PURPOSE OF ANY LIMITED REMEDY PROVIDED HEREIN.",4.3
"8 INDEMNIFICATION. 8.1 By Commerce One. Commerce One shall indemnify, defend and hold harmless Corio and its Customers from any and all damages, liabilities, costs and expenses (including reasonable attorneys' fees) incurred by Corio or its Customers arising out of any claim that the Software infringes any patent, copyright, trademark or trade right secret of a third party; omitted 9 LIMITATION OF LIABILITY. EXCEPT FOR LIABILITY ARISING UNDER SECTION 8 OF THIS AGREEMENT, IN NO EVENT SHALL EITHER PARTY'S LIABILITY ARISING OUT OF THIS AGREEMENT OR THE USE OR PERFORMANCE OF THE SOFTWARE EXCEED THE TOTAL AMOUNT ACTUALLY PAID BY CORIO HEREUNDER FOR THE TRANSACTION WHICH THE LIABILITY RELATES TO DURING THE TWELVE (12) MONTHS IMMEDIATELY PRIOR TO THE FILING OF THE CAUSE OF ACTION TO WHICH THE LIABILITY RELATES. EXCEPT FOR LIABILITY ARISING UNDER SECTION 8 OF THIS AGREEMENT, IN NO EVENT SHALL EITHER PARTY HAVE ANY LIABILITY TO THE OTHER PARTY FOR ANY LOST PROFITS OR COSTS OF PROCUREMENT OF SUBSTITUTE GOODS OR SERVICES, OR FOR ANY INDIRECT, SPECIAL OR CONSEQUENTIAL DAMAGES HOWEVER CAUSED AND UNDER ANY THEORY OF LIABILITY AND WHETHER OR NOT SUCH PARTY HAS BEEN ADVISED OF THE POSSIBILITY OF SUCH DAMAGE. THE PARTIES AGREE THAT THIS SECTION 9 REPRESENTS A REASONABLE ALLOCATION OF RISK.",3.7
"11.3 Limitation of Liability. NEITHER PARTY SHALL BE LIABLE, WHETHER BASED ON CONTRACT LAW, TORTS OR ANY OTHER AREA OF LAW, FOR ANY INDIRECT, INCIDENTAL, SPECIAL OR CONSEQUENTIAL DAMAGES ARISING OUT OF OR IN ANY WAY RELATED TO THIS AGREEMENT OR ITS PERFORMANCE AND THE MAXIMUM TOTAL LIABILITY OF EITHER PARTY WHETHER BASED ON CONTRACT LAW, TORTS OR ANY OTHER AREA OF LAW SHALL BE LIMITED TO THE AMOUNT . NOTWITHSTANDING THE FOREGOING, THESE LIMITATIONS SHALL NOT APPLY TO DAMAGES ARISING FROM A PARTY'S (I) INDEMNIFICATION OBLIGATIONS UNDER SECTION 11.1 OR SECTION 11.2 HEREOF, (II) GROSS NEGLIGENCE OR WILFUL MISCONDUCT, (III) BREACH OF ITS OBLIGATIONS UNDER SECTION 9 OR (IV) INFRINGEMENT OR MISAPPROPRIATION OF THE OTHER PARTY'S INTELLECTUAL PROPERTY.",3.7
"9.4 LIMITATIONS ON LIABILITY. EXCEPT FOR LIABILITY ARISING FROM SECTION 9.3 Intellectual Property Infringement, IN NO EVENT SHALL EITHER PARTY BE LIABLE TO THE OTHER FOR ANY INDIRECT, SPECIAL, INCIDENTAL, PUNITIVE OR CONSEQUENTIAL DAMAGES, LOSSES, OR EXPENSES INCLUDING, BUT NOT LIMITED TO, LOSS OF USE, LOSS OF PROFITS, OR LOSS OF GOODWILL, EVEN IF THAT PARTY HAS BEEN ADVISED OF THE POSSIBILITY OF SUCH LOSS OR DAMAGE. EXCEPT FOR LIABILITY ARISING FROM SECTION 9.3 Intellectual Property Infringement, IN NO EVENT SHALL EITHER PARTY BE LIABLE UNDER THIS AGREEMENT FOR AN AMOUNT GREATER THAN THE AMOUNT THAT SUCH PARTY HAS EARNED PURSUANT TO THE REVENUE SHARING PROVISIONS OF SECTION 5.4 Share of Net Revenue IN THE TWELVE MONTH PERIOD PRECEDING THE CLAIM",3.0
"12. Limitation of Liability 12.1 IN NO EVENT SHALL EITHER PARTY BE LIABLE TO THE OTHER PARTY FOR ANY INCIDENTAL, CONSEQUENTIAL, INDIRECT, SPECIAL, OR PUNITIVE DAMAGES (INCLUDING, BUT NOT LIMITED TO, LOST PROFITS, BUSINESS INTERRUPTION, LOSS OF BUSINESS INFORMATION OR OTHER PECUNIARY LOSS) REGARDLESS OF WHETHER SUCH LIABILITY IS BASED ON BREACH OF CONTRACT, TORT (INCLUDING NEGLIGENCE), STRICT LIABILITY, BREACH OF WARRANTIES, FAILURE OF ESSENTIAL PURPOSE OR OTHERWISE AND EVEN IF ADVISED OF THE POSSIBILITY OF SUCH DAMAGES. 12.2 Except with regard to a breach of confidentiality, a party's indemnification obligations hereunder, or infringement of intellectual property rights, either party's total liability to the other party under this Agreement shall be limited to the amounts paid or payable by the Reseller to Todos during the twelve-month period preceding the interposition of the claim.",3.7
"10. INDEMNITIES. omitted WITHOUT AFFECTING STRICT PRODUCT LIABILITY UNDER MANDATORY APPLICABLE LAW, SECTION 10, OR THE RESPECTIVE OBLIGATIONS OF THE PARTIES UNDER THE CONFIDENTIAILITY AGREEMENT AND EXCEPT FOR BREACHES ASSOCIATED WITH THE UNAUTHORIZED USE OF INTELLECTUAL PROPERTY, IN NO EVENT SHALL EITHER PARTY BE LIABLE TO THE OTHER PARTY FOR SPECIAL, INCIDENTAL, CONSEQUENTIAL, PUNITIVE OR TORT DAMAGES, INCLUDING WITHOUT LIMITATION, ANY DAMAGES RESULTING FROM LOSS OF USE, LOSS OF DATA, LOSS OF PROFITS OR LOSS OF BUSINESS ARISING OUT OF OR IN CONNECTION WITH THE MATTERS CONTEMPLATED BY THIS AGREEMENT, WHETHER OR NOT A PARTY HAS BEEN ADVISED OF THE POSSIBILITY OF SUCH DAMAGES. omitted 11.3. Liability Cap. Without affecting Section 10 or the respective obligations of the parties under the Confidentiality Agreement and except for any liability (i) relating to any breach associated with the unauthorized use of Intellectual Property, (ii) arising from the intentional breach or willful misconduct of a party, or (iii) arising from the non-compliance with any mandatory applicable law or regulation, the total aggregate liability of one party to another party for any claim relating to any breach of this Agreement (or any Purchase Order or other agreement entered into in connection with this Agreement) (a Claim) shall be limited to the aggregate amount of the purchase prices paid by Distributor to Accuray for Products pursuant to this Agreement (or any Purchase Order or other Agreement entered into in connection with this Agreement) during the twelve calendar months preceding the date of the notification to the other party of such Claim less any amounts paid or payable in respect of any other Claim of which the other party was notified during such twelve month period.",4.3
"ARTICLE 12 LIMITATION OF LIABILITY 12.1 Limitation of Liability. Except for liability for (i) breach of the confidentiality obligations described in Article 14, (ii) misappropriation or infringement by a Party of the other Party's Intellectual Property Rights, or (iii) gross negligence or willful misconduct: (a) IN NO EVENT SHALL A PARTY BE LIABLE FOR ANY PUNITIVE, EXEMPLARY, INDIRECT, INCIDENTAL, SPECIAL, OR CONSEQUENTIAL DAMAGES OR EXPENSES, INCLUDING LOSS OF PROFITS, REVENUE, DATA, OR USE, WHETHER IN AN ACTION IN CONTRACT OR TORT (INCLUDING ERRORS OR OMISSIONS OR BREACH OF WARRANTY), EVEN IF SUCH PARTY HAS BEEN ADVISED OF THE POSSIBILITY OF SUCH DAMAGES; (b) EACH PARTY'S MAXIMUM LIABILITY FOR ANY DAMAGES FOR BREACH OF THIS AGREEMENT SHALL BE LIMITED TO DIRECT AND ACTUAL DAMAGES. IN NO ONE EVENT SHALL EITHER PARTY'S AGGREGATE LIABILITY FOR DAMAGES OR LOSSES UNDER THIS AGREEMENT EXCEED THE AGGREGATE AMOUNT OF THE PRODUCT PRICES PAID BY BELLICUM FOR THE MILTENYI PRODUCT(S) DURING THE TWELVE (12) MONTH PERIOD IMMEDIATELY PRECEDING THE EVENT GIVING RISE TO SUCH LIABILITY; AND FURTHER PROVIDED THAT SUCH AGGREGATE LIABILITY DURING SUCH PERIOD ALSO SHALL NOT EXCEED THE AMOUNT OF SUCH PARTY'S INSURANCE COVERAGE FOR SUCH AGGREGATE LIABILITY.",3.0
"7.2 Indemnity. Each Party (as applicable, the Indemnifying Party) will defend, indemnify and hold harmless the other Party (the Indemnified Party) and its Affiliates (and their respective employees, directors and representatives) from and against any and all claims, costs, losses, damages, judgments and expenses (including reasonable attorneys' fees) arising out of any Claim, to the extent it is based on (a) the operation or content of the Indemnifying Party's Site (other than any items or materials supplied, or operation or content required, by the Indemnified Party), (b) the offer, marketing or sale of any products or services through the Indemnifying Party's Site (other than any products offered, marketed or sold by the Indemnified Party through such Site, the Parties acknowledging that Company shall be deemed the Indemnifying Party as to any Claim related to any products offered, marketed or sold by Company through the Spoken-Word Audio Sub-Section and/or Mirror Company Site, except to the extent that such Claim relates to any ACSI Site Functionality or other items or content provided by or for ACSI with respect to the Spoken-Word Audio Sub-Section and/or Mirror Company Site), (c) any actual or alleged breach of the Indemnifying Party's representations or warranties set forth in Section 7.1 Representations above, or, in the case of Company, its obligations under Section 4.4 Regulatory Compliance above, or (d) any actual or alleged infringement of any Intellectual Property Rights by any content, items or materials provided by the Indemnifying Party to the Indemnified Party for its use under this Agreement. Subject to Section 7.3 Procedure, the Indemnifying Party will pay any award against the Indemnified Party and its Affiliates (and their respective employees, directors or representatives) and any costs and attorneys' fees reasonably incurred by them resulting from any such Claim. omitted 8.2 No Consequential Damages. EXCEPT TO THE EXTENT AWARDED TO A THIRD PARTY IN A JUDGMENT AGAINST WHICH A PARTY IS ENTITLED TO INDEMNIFICATION PURSUANT TO SECTION 7.2 Indemnity, OR TO THE EXTENT ARISING OUT OF ANY BREACH OF SECTION 11.4 Nondisclosure, NEITHER PARTY WILL BE LIABLE (WHETHER IN CONTRACT, WARRANTY, TORT (INCLUDING, BUT NOT LIMITED TO, NEGLIGENCE), PRODUCT LIABILITY OR OTHER THEORY), TO THE OTHER PARTY OR ANY OTHER PERSON OR ENTITY FOR COST OF COVER OR FOR ANY INDIRECT, INCIDENTAL, SPECIAL OR CONSEQUENTIAL DAMAGES (INCLUDING WITHOUT LIMITATION DAMAGES FOR LOSS OF PROFIT, REVENUE, BUSINESS OR DATA) ARISING OUT OF THIS AGREEMENT, EVEN IF SUCH PARTY HAS BEEN ADVISEDOF THE POSSIBILITY OF SUCH COSTS OR DAMAGES. FOR THE AVOIDANCE OF DOUBT, THE PARTIES HEREBY ACKNOWLEDGE AND AGREE THAT NOTHING IN THIS SECTION 8.2 No Consequential Damages IS INTENDED TO LIMIT ANY RIGHT OF ACSI TO RECEIVE LIQUIDATED DAMAGES AS SET FORTH IN SECTION 10.5.2 Effect of Termination. 8.3 Limitation of Damages. EXCEPT FOR LIABILITIES UNDER SECTION 7.2 Indemnity, NEITHER PARTY'S AGGREGATE LIABILITY ARISING OUT OF OR IN CONNECTION WITH THIS AGREEMENT OR THE TRANSACTIONS CONTEMPLATED HEREBY, WHETHER IN CONTRACT, TORT (INCLUDING NEGLIGENCE), WARRANTY OR OTHERWISE, SHALL EXCEED .",4.3
