clause_text,rating
"10. INDEMNITIES. omitted WITHOUT AFFECTING STRICT PRODUCT LIABILITY UNDER MANDATORY APPLICABLE LAW, SECTION 10, OR THE RESPECTIVE OBLIGATIONS OF THE PARTIES UNDER THE CONFIDENTIAILITY AGREEMENT AND EXCEPT FOR BREACHES ASSOCIATED WITH THE UNAUTHORIZED USE OF INTELLECTUAL PROPERTY, IN NO EVENT SHALL EITHER PARTY BE LIABLE TO THE OTHER PARTY FOR SPECIAL, INCIDENTAL, CONSEQUENTIAL, PUNITIVE OR TORT DAMAGES, INCLUDING WITHOUT LIMITATION, ANY DAMAGES RESULTING FROM LOSS OF USE, LOSS OF DATA, LOSS OF PROFITS OR LOSS OF BUSINESS ARISING OUT OF OR IN CONNECTION WITH THE MATTERS CONTEMPLATED BY THIS AGREEMENT, WHETHER OR NOT A PARTY HAS BEEN ADVISED OF THE POSSIBILITY OF SUCH DAMAGES. omitted 11.3. Liability Cap. Without affecting Section 10 or the respective obligations of the parties under the Confidentiality Agreement and except for any liability (i) relating to any breach associated with the unauthorized use of Intellectual Property, (ii) arising from the intentional breach or willful misconduct of a party, or (iii) arising from the non-compliance with any mandatory applicable law or regulation, the total aggregate liability of one party to another party for any claim relating to any breach of this Agreement (or any Purchase Order or other agreement entered into in connection with this Agreement) (a Claim) shall be limited to the aggregate amount of the purchase prices paid by Distributor to Accuray for Products pursuant to this Agreement (or any Purchase Order or other Agreement entered into in connection with this Agreement) during the twelve calendar months preceding the date of the notification to the other party of such Claim less any amounts paid or payable in respect of any other Claim of which the other party was notified during such twelve month period.",3.3
"8.3 Limitation of Damages. EXCEPT FOR LIABILITIES UNDER SECTION 7.2 Indemnity, NEITHER PARTY'S AGGREGATE LIABILITY ARISING OUT OF OR IN CONNECTION WITH THIS AGREEMENT OR THE TRANSACTIONS CONTEMPLATED HEREBY, WHETHER IN CONTRACT, TORT (INCLUDING NEGLIGENCE), WARRANTY OR OTHERWISE, SHALL EXCEED .",3.0
"F. Limitation of liability. VIP shall have no liability with respect to its obligations under this agreement or otherwise for consequential, exemplary, special, indirect, incidental or punitive damages even if it has been advised of the possibility of such damages in any event, other than claims covered by paragraph 8(b) or paragraph 6(a) of this agreement (which claims are excluded from this paragraph 9(f) limitation), the liability of VIP to BNL for any reason and upon any cause of action or claim in contract, tort or otherwise shall be limited to the amount paid by BNL to VIP in the twelve (12) month period prior to the accrual of the action or claim for the specific service which is the subject of the action or claim (or, if such accrual occurs during the first twelve (12) months of the initial term, then the liability shall be limited to the minimum fees payable by BNL to VIP during the first twelve (12) months of the initial term). except for the claims excluded by the preceding sentence, this limitation applies to all causes of action or claims in the aggregate including without limitation breach of contract, breach of warranty, negligence, strict liability, misrepresentation and other torts. BNL and VIP acknowledge and agree that the limitations and exclusions contained herein represent the parties' agreement as to the allocation of risk between the parties in connection with VIP's obligations under this agreement. the payments payable to VIP in connection herewith reflect this allocation of risk and the exclusion of consequential damages in this agreement.",3.7
"2.7 RESTRICTIONS. omitted 8 INDEMNIFICATION. omitted 9 LIMITATION OF LIABILITY. EXCEPT FOR LIABILITY ARISING UNDER SECTIONS 2.7, 8, 10 AND 12.3 OF THIS AGREEMENT, IN NO EVENT SHALL EITHER PARTY'S LIABILITY ARISING OUT OF OR RELATED TO THIS AGREEMENT OR THE USE OR PERFORMANCE OF THE SOFTWARE EXCEED THE TOTAL AMOUNT ACTUALLY PAID BY CORIO HEREUNDER FOR THE TRANSACTION WHICH THE LIABILITY RELATES TO DURING THE TWELVE (12) MONTHS IMMEDIATELY PRIOR TO THE CAUSE OF ACTION FIRST ARISING, EVEN IF IT IS A CONTINUOUS ONE, OR IN THE AGGREGATE, WITH RESPECT OF ALL CLAIMS ARISING OUT OF OR RELATED TO THIS AGREEMENT, THE TOTAL AMOUNT ACTUALLY PAID BY CORIO UNDER THIS AGREEMENT TO CHANGEPOINT. EXCEPT FOR LIABILITY ARISING UNDER SECTIONS 2.7, 8, 10 AND 12.3 OF THIS AGREEMENT, IN NO EVENT SHALL EITHER PARTY HAVE ANY LIABILITY TO THE OTHER PARTY FOR ANY LOST PROFITS OR COSTS OF PROCUREMENT OF SUBSTITUTE GOODS OR SERVICES, OR FOR ANY INDIRECT, INCIDENTIAL, SPECIAL OR CONSEQUENTIAL DAMAGES HOWEVER CAUSED AND UNDER ANY THEORY OF LIABILITY AND WHETHER OR NOT SUCH PARTY HAS BEEN ADVISED OF THE POSSIBILITY OF SUCH DAMAGE. THE PARTIES AGREE THAT THIS SECTION 9 REPRESENTS A REASONABLE ALLOCATION OF RISK. omitted 10 CONFIDENTIALITY. omitted 12.3 LICENSE.",4.7
"8 INDEMNIFICATION. 8.1 By Commerce One. Commerce One shall indemnify, defend and hold harmless Corio and its Customers from any and all damages, liabilities, costs and expenses (including reasonable attorneys' fees) incurred by Corio or its Customers arising out of any claim that the Software infringes any patent, copyright, trademark or trade right secret of a third party; omitted 9 LIMITATION OF LIABILITY. EXCEPT FOR LIABILITY ARISING UNDER SECTION 8 OF THIS AGREEMENT, IN NO EVENT SHALL EITHER PARTY'S LIABILITY ARISING OUT OF THIS AGREEMENT OR THE USE OR PERFORMANCE OF THE SOFTWARE EXCEED THE TOTAL AMOUNT ACTUALLY PAID BY CORIO HEREUNDER FOR THE TRANSACTION WHICH THE LIABILITY RELATES TO DURING THE TWELVE (12) MONTHS IMMEDIATELY PRIOR TO THE FILING OF THE CAUSE OF ACTION TO WHICH THE LIABILITY RELATES. EXCEPT FOR LIABILITY ARISING UNDER SECTION 8 OF THIS AGREEMENT, IN NO EVENT SHALL EITHER PARTY HAVE ANY LIABILITY TO THE OTHER PARTY FOR ANY LOST PROFITS OR COSTS OF PROCUREMENT OF SUBSTITUTE GOODS OR SERVICES, OR FOR ANY INDIRECT, SPECIAL OR CONSEQUENTIAL DAMAGES HOWEVER CAUSED AND UNDER ANY THEORY OF LIABILITY AND WHETHER OR NOT SUCH PARTY HAS BEEN ADVISED OF THE POSSIBILITY OF SUCH DAMAGE. THE PARTIES AGREE THAT THIS SECTION 9 REPRESENTS A REASONABLE ALLOCATION OF RISK.",3.0
"20. LIMITATION OF LIABILITY Except as provided by Sections 19(a)(iii)(2), (a)(iii)(3), (b)(iii)(2) and (b)(iii)(3): a) Neither party will have liability for any damages other than direct damages. In no event will either party be liable to the other for any special, incidental or consequential damages, whether based on breach of contract, tort (including negligence) or otherwise, whether or not that party has been advised of the possibility of such damage. b) Either party's liability for damages shall be limited to the amounts actually paid by the other party.",4.0
"ARTICLE XIII CONFIDENTIALITY omitted ARTICLE XIV MISCELLANEOUS Section 14.1 Notices. All notices, consents, and other communications between the parties under or regarding this Agreement shall be in writing and shall be sent to the recipient's address set forth in this section. Such communications shall be deemed to have been received on the date actually received. Section 10.5 Limitations. (a) EXCEPT IN CONNECTION WITH A BREACH OF ARTICLE XIII OF THIS AGREEMENT AND WITH THE EXCEPTION OF THE INDEMNIFICATION OBLIGATIONS OF THE PARTIES UNDER ARTICLE X, IN NO EVENT SHALL EITHER PARTY BE LIABLE TO THE OTHER PARTY OR ANY OTHER PERSON OR ENTITY FOR ANY INDIRECT, INCIDENTAL, CONSEQUENTIAL, SPECIAL, PUNITIVE, EXEMPLARY, OR EXTRA-CONTRACTUAL DAMAGES OF ANY KIND WHATSOEVER ARISING FROM OR CONNECTED WITH THIS AGREEMENT, INCLUDING, BUT NOT LIMITED TO, LOST PROFITS, LOST REVENUES, OR LOSS OF BUSINESS, REGARDLESS OF LEGAL THEORY, WHETHER OR NOT FORESEEABLE, EVEN IF EITHER PARTY HERETO HAS BEEN ADVISED OF THE POSSIBILITY OR PROBABILITY OF SUCH DAMAGES AND EVEN IF THE REMEDIES OTHERWISE PROVIDED BY THIS AGREEMENT FAIL OF THEIR ESSENTIAL PURPOSE. THE REMEDIES PROVIDED BY THIS AGREEMENT AND THE PROVISIONS OF THIS AGREEMENT ALLOCATE THE RISKS OF THIS AGREEMENT BETWEEN THE PARTIES, SOME OF WHICH MAY BE UNKNOWN OR UNDERMINABLE. THESE LIMITATIONS ARE A MATERIAL INDUCEMENT FOR THE PARTIES TO THIS AGREEMENT TO ENTER INTO THIS AGREEMENT, AND THE PARTIES TO THIS AGREEMENT HAVE RELIED UPON THESE PROVISIONS IN DETERMINING WHETHER OR NOT TO ENTER INTO THIS AGREEMENT. (b) EXCEPT IN CONNECTION WITH A BREACH OF ARTICLE XIV HEREUNDER, AND WITH THE EXCEPTION OF THE INDEMNIFICATION OBLIGATIONS OF THE PARTIES UNDER ARTICLE X, THE AGGREGATE TOTAL LIABILITY OF EITHER PARTY TO THE OTHER PARTY AND TO ALL OTHER PERSONS AND ENTITIES UNDER THIS AGREEMENT SHALL UNDER NO CIRCUMSTANCES EXCEED THE AMOUNT OF THE NET REVENUE RECEIVED BY NCM PURSUANT TO SECTION 7.2 OF THIS AGREEMENT DURING THE FIVE (5) YEAR PERIOD PRECEDING SUCH LIABILITY, LESS IN ANY CASE THE AGGREGATE OF ANY AMOUNTS PAID BY NCM HEREUNDER ON ACCOUNT OF PREVIOUS EVENTS OF LIABILITY.",4.0
"11.3 Limitation of Liability. NEITHER PARTY SHALL BE LIABLE, WHETHER BASED ON CONTRACT LAW, TORTS OR ANY OTHER AREA OF LAW, FOR ANY INDIRECT, INCIDENTAL, SPECIAL OR CONSEQUENTIAL DAMAGES ARISING OUT OF OR IN ANY WAY RELATED TO THIS AGREEMENT OR ITS PERFORMANCE AND THE MAXIMUM TOTAL LIABILITY OF EITHER PARTY WHETHER BASED ON CONTRACT LAW, TORTS OR ANY OTHER AREA OF LAW SHALL BE LIMITED TO THE AMOUNT . NOTWITHSTANDING THE FOREGOING, THESE LIMITATIONS SHALL NOT APPLY TO DAMAGES ARISING FROM A PARTY'S (I) INDEMNIFICATION OBLIGATIONS UNDER SECTION 11.1 OR SECTION 11.2 HEREOF, (II) GROSS NEGLIGENCE OR WILFUL MISCONDUCT, (III) BREACH OF ITS OBLIGATIONS UNDER SECTION 9 OR (IV) INFRINGEMENT OR MISAPPROPRIATION OF THE OTHER PARTY'S INTELLECTUAL PROPERTY.",3.3
"ARTICLE 12 LIMITATION OF LIABILITY 12.1 Limitation of Liability. Except for liability for (i) breach of the confidentiality obligations described in Article 14, (ii) misappropriation or infringement by a Party of the other Party's Intellectual Property Rights, or (iii) gross negligence or willful misconduct: (a) IN NO EVENT SHALL A PARTY BE LIABLE FOR ANY PUNITIVE, EXEMPLARY, INDIRECT, INCIDENTAL, SPECIAL, OR CONSEQUENTIAL DAMAGES OR EXPENSES, INCLUDING LOSS OF PROFITS, REVENUE, DATA, OR USE, WHETHER IN AN ACTION IN CONTRACT OR TORT (INCLUDING ERRORS OR OMISSIONS OR BREACH OF WARRANTY), EVEN IF SUCH PARTY HAS BEEN ADVISED OF THE POSSIBILITY OF SUCH DAMAGES; (b) EACH PARTY'S MAXIMUM LIABILITY FOR ANY DAMAGES FOR BREACH OF THIS AGREEMENT SHALL BE LIMITED TO DIRECT AND ACTUAL DAMAGES. IN NO ONE EVENT SHALL EITHER PARTY'S AGGREGATE LIABILITY FOR DAMAGES OR LOSSES UNDER THIS AGREEMENT EXCEED THE AGGREGATE AMOUNT OF THE PRODUCT PRICES PAID BY BELLICUM FOR THE MILTENYI PRODUCT(S) DURING THE TWELVE (12) MONTH PERIOD IMMEDIATELY PRECEDING THE EVENT GIVING RISE TO SUCH LIABILITY; AND FURTHER PROVIDED THAT SUCH AGGREGATE LIABILITY DURING SUCH PERIOD ALSO SHALL NOT EXCEED THE AMOUNT OF SUCH PARTY'S INSURANCE COVERAGE FOR SUCH AGGREGATE LIABILITY.",3.3
"11. LIMITATION OF LIABILITY IN NO EVENT SHALL EITHER PARTY BE LIABLE TO THE OTHER PARTY FOR LOST PROFITS OR ANY CONSEQUENTIAL, SPECIAL, INCIDENTAL, OR INDIRECT DAMAGES OR SUCH OTHER PARTY, HOWEVER CAUSED AND ON ANY THEORY OF LIABILITY, ARISING OUT OF THIS AGREEMENT. THESE LIMITATIONS SHALL APPLY NOTWITHSTANDING ANY FAILURE OF ESSENTIAL PURPOSE OF ANY LIMITED REMEDY. IN NO EVENT SHALL D2'S LIABILITY HEREUNDER EXCEED THE TOTAL AMOUNT PAID OR OWED BY LICENSEE TO D2 UNDER THIS AGREEMENT.",4.0
"8.5 Limitation of Liability. NO PARTY WILL BE LIABLE TO THE OTHER PARTY IN TORT, CONTRACT OR UNDER ANY OTHER LEGAL THEORY FOR ANY CONSEQUENTIAL, INDIRECT, INCIDENTAL, PUNITIVE OR SPECIAL LOSS OR DAMAGES ARISING OUT OF THIS AGREEMENT, EVEN IF APPRISED OF THE LIKELIHOOD OF SUCH DAMAGES OCCURRING. IN NO EVENT WILL IMNTV'S LIABILITY TO DISTRIBUTOR UNDER THIS AGREEMENT EXCEED THE AMOUNT ACTUALLY DUE TO IMNTV HEREIN.",3.7
"Notwithstanding anything herein to the contrary, AJR's liability under this Section 11 shall not exceed One Hundred Fifty Thousand Dollars ($150,000).",4.0
"Virtual hereby agrees to and does (a) waive any and all suits, actions, claims, losses, demands, damages, liabilities, costs, and reasonable expenses of every kind (including consequential, incidental, or punitive damages, or lost profits), including court costs and reasonable attorneys' fees (collectively, Claims) Virtual may have now or in the future against Forty Niners SC, its Affiliates, the National Football League, SCSA, and any of their respective officers, directors, employees, agents, insurers, and assigns (collectively, the Indemnitees) for damage to or destruction of Virtual's property, excepting only claims caused by the gross negligence or willful misconduct of an Indemnitee; (b) fully compensate Forty Niners SC, the SCSA, and their respective Affiliates (Indemnitees) for damage to or destruction of their tangible property caused by, resulting from, or arising out of Virtual's negligence or willful misconduct under this Agreement; omitted",2.0
"6.00 SUBJECT TO AND EXCEPT FOR ANY INDEMNIFICATION OBLIGATIONS UNDER ARTICLE 3.09 ABOVE, NOTHING IN THIS IP AGREEMENT WILL BE DEEMED TO BE A REPRESENTATION OR WARRANTY BY COMPANY OF THE ACCURACY, SAFETY OR USEFULNESS FOR ANY PURPOSE OF ANY TECHNICAL INFORMATION, TECHNIQUES, OR PRACTICES AT ANY TIME MADE AVAILABLE BY COMPANY. COMPANY WILL HAVE NO LIABILITY WHATSOEVER TO INVESTOR OR ANY OTHER PERSON FOR OR ON ACCOUNT OF ANY INJURY, LOSS OR DAMAGE OF ANY KIND OR NATURE, SUSTAINED BY, OR ANY DAMAGES ASSESSED OR ASSERTED AGAINST, OR ANY OTHER LIABILITY INCURRED BY OR IMPOSED ON INVESTOR OR ANY OTHER PERSON, ARISING OUT OF OR IN CONNECTION WITH OR RESULTING FROM: (A) THE PRODUCTION, USE OR SALE OF ANY APPARATUS OR PRODUCT OR METHOD, OR THE PRACTICE OF THE PATENTS BY INVESTOR OR ITS ASSIGNS; (B) THE USE BY INVESTOR OR ITS ASSIGNS OF ANY TECHNICAL INFORMATION, TECHNIQUES, OR PRACTICES DISCLOSED BY COMPANY; OR (C) ANY ADVERTISING OR OTHER PROMOTIONAL ACTIVITIES BY INVESTOR OR ITS ASSIGNS WITH RESPECT TO ANY OF THE FOREGOING, AND INVESTOR WILL HOLD COMPANY, AND ITS OFFICERS, EMPLOYEES AND AGENTS, HARMLESS IN THE EVENT COMPANY, OR ITS OFFICERS, EMPLOYEES OR AGENTS, IS HELD LIABLE.",2.0
"Disclaimer of Warranties. UNLESS SPECIFIED OTHERWISE HEREIN (INCLUDING BUT NOT LIMITED TO THE BACK TO BACK WARRANTY SPECIFIED IN SECTION 6.5) AND WITHOUT LIMITATION TO ANY WARRANTY WHICH SUPPLIER MAY, IN ITS SOLE DISCRETION, MAKE TO ANY CUSTOMER AND/OR END USER, THE PRODUCTS ARE PROVIDED ON AN AS IS AND AS AVAILABLE BASIS, AND SUPPLIER DOES NOT MAKE ANY WARRANTIES, EXPRESS OR IMPLIED, WITH RESPECT TO THE PRODUCTS OR ITS OPERATION THEREOF, MERCHANTABILITY AND FITNESS FOR A PARTICULAR PURPOSE.",2.0
"NO PARTY SHALL BE LIABLE FOR CONSEQUENTIAL, INCIDENTAL, PUNITIVE, EXEMPLARY OR INDIRECT DAMAGES, LOST PROFITS OR OTHER BUSINESS INTERRUPTION DAMAGES, BY STATUTE, IN TORT OR CONTRACT, OR OTHERWISE; PROVIDED, HOWEVER, THAT THIS LIMITATION SHALL NOT LIMIT A PARTY'S RIGHT TO RECOVERY HEREUNDER FOR ANY SUCH DAMAGES TO THE EXTENT SUCH PARTY IS REQUIRED TO PAY SUCH DAMAGES TO A THIRD PARTY IN CONNECTION WITH A MATTER FOR WHICH SUCH PARTY IS OTHERWISE ENTITLED TO INDEMNIFICATION HEREUNDER. THE LIMITATIONS IMPOSED ON REMEDIES AND THE MEASURE OF DAMAGES SHALL BE WITHOUT REGARD TO THE CAUSE OR CAUSES RELATED THERETO, INCLUDING THE NEGLIGENCE OF ANY PARTY, WHETHER SUCH NEGLIGENCE BE SOLE, JOINT OR CONCURRENT, OR ACTIVE OR PASSIVE.",2.0
"(b) Limitation of Liability. IN NO EVENT SHALL EITHER PARTY BE LIABLE TO THE OTHER FOR ANY SPECIAL, INDIRECT, EXEMPLARY OR CONSEQUENTIAL DAMAGES ARISING OUT OF THIS AGREEMENT OR PURCHASE OR USE OF THE PRODUCTS. 10. FORCE MAJEURE. Neither Party shall be held liable for any failure to perform that is due to any cause or circumstance beyond the reasonable control of such Party, including without limitation a demand for such Products and other products manufactured by Company which exceeds Company's ability to supply them, earthquakes, fire, accidents, floods, storms, other Acts of God, riots, wars, rebellions, strikes, lockouts or other labor disturbances, national or international emergencies, failure to secure materials or equipment from usual sources of supply, failure of carriers to furnish transportation, government rules, regulations, acts, orders, world financial crisis, restrictions or requirements or any other cause or circumstance beyond the reasonable control of such Party. No such inability to deliver or delay in delivery shall invalidate the remainder of this Agreement.",2.0
"The rights, duties, obligations and liabilities of the Parties shall be separate, not joint or collective. Each Party shall be responsible only for its obligations as herein set out and shall be liable only for its share of the costs and expenses as provided herein.",2.0
"Section 7.01. Limitation on Liability. Without limiting the terms set forth in Section 6.09 of the Separation Agreement, none of Honeywell, SpinCo or any other member of either Group shall in any event have any Liability to the other or to any other member of the other's Group under this Agreement for any indirect, special, punitive or consequential damages, whether or not caused by or resulting from negligence or breach of obligations hereunder and whether or not informed of the possibility of the existence of such damages.",2.0
"7.2. Disclaimer. LICENSEE HEREBY ACKNOWLEDGES AND AGREES THAT EXCEPT AS EXPRESSLY SET FORTH HEREIN OR IN THE SHARE PURCHASE AGREEMENT, THE LICENSED DOMAIN NAMES AND THE LICENSED CONTENT ARE PROVIDED WITHOUT WARRANTY OF ANY KIND, EXPRESS OR IMPLIED, INCLUDING WITHOUT LIMITATION, WARRANTIES OF MERCHANTABILITY, VALIDITY, NONINFRINGEMENT, FITNESS FOR A PARTICULAR PURPOSE OR OTHER WARRANTIES, WHETHER EXPRESS OR IMPLIED, AND LICENSOR HEREBY DISCLAIMS ANY AND ALL SUCH WARRANTIES.",2.0
"In no event will NFLA be liable for any indirect, incidental, reliance, special or consequential damages arising out of the performance or nonperformance of this Agreement, whether or not NFLA had been advised of the possibility of such damages.",2.0
"29.0 LIMITATION OF LIABILITY 29.1 Neither Party shall be liable to the other for any special, indirect, incidental, consequential, punitive or exemplary damages, including, but not limited to, lost profits, even if such Party alleged to be liable has knowledge of the possibility of such damages, provided, however, that the limitations set forth in this Section shall not apply to or in any way limit the obligations of the Section entitled Indemnity, the Section entitled Confidentiality and Information Protection, or Supplier's gross negligence or willful misconduct.",2.0
"(b) THE MATERIALS PROVIDED TO INSTITUTION BY LBIO ARE PROVIDED BY LBIO ON AN AS IS BASIS. LBIO HEREBY DISCLAIMS ANY WARRANTIES, EXPRESS OR IMPLIED, CONCERNING THE MATERIALS, INCLUDING ANY WARRANTIES OF TITLE, INFRINGEMENT, MERCHANTABILITY OR FITNESS FOR A PARTICULAR PURPOSE. NO OFFICER, EMPLOYEE, AGENT OR REPRESENTATIVE OF LBIO HAS ANY AUTHORITY TO BIND LBIO TO ANY AFFIRMATION, REPRESENTATION OR WARRANTY CONCERNING THE MATERIALS, EXCEPT AS SET EXPRESSLY FORTH HEREIN. THE MATERIALS PROVIDED TO LBIO BY INSTITUTION ARE PROVIDED BY INSTITUTION ON AN AS IS BASIS. INSTITUTION HEREBY DISCLAIMS ANY WARRANTIES, EXPRESS OR IMPLIED, CONCERNING THE MATERIALS, INCLUDING ANY WARRANTIES OF TITLE, INFRINGEMENT, MERCHANTABILITY OR FITNESS FOR A PARTICULAR PURPOSE. NO OFFICER, EMPLOYEE, AGENT OR REPRESENTATIVE OF INSTITUTION HAS ANY AUTHORITY TO BIND INSTITUTION TO ANY AFFIRMATION, REPRESENTATION OR WARRANTY CONCERNING THE MATERIALS, EXCEPT AS SET EXPRESSLY FORTH HEREIN.",2.0
"9.15 DISCLAIMER OF SPECIAL DAMAGES. NEITHER LBIO NOR MD ANDERSON, NOR ANY OF THEIR AFFILIATES, NOR ANY OF THEIR RESPECTIVE DIRECTORS, OFFICERS, MEMBERS OR EMPLOYEES, SHALL HAVE ANY LIABILITY OF ANY TYPE, FOR ANY SPECIAL, PUNITIVE, INCIDENTAL, INDIRECT OR CONSEQUENTIAL DAMAGES, INCLUDING THE LOSS OF OPPORTUNITY, LOSS OF USE, OR LOSS OF REVENUE OR PROFIT, IN CONNECTION WITH OR ARISING OUT OF THIS AGREEMENT OR ANY STUDY ORDER; PROVIDED, THAT, THE FOREGOING DISCLAIMER SHALL NOT APPLY WITH RESPECT TO (1) A PARTY'S INDEMNIFICATION OBLIGATIONS, (2) A PARTY'S BREACH OF ITS OBLIGATIONS UNDER THIS AGREEMENT WITH RESPECT TO CONFIDENTIALITY AND NON-USE OR INTELLECTUAL PROPERTY-RELATED MATTERS OR (3) A PARTY'S GROSS NEGLIGENCE OR WILLFUL MISCONDUCT.",2.0
"(a) FASC shall not be responsible for any error of judgment or mistake of law or for any loss suffered by the Advisor or any Account in connection with the matters to which this Agreement relates, except a loss resulting from willful malfeasance, bad faith or gross negligence on its part in the performance of its duties or from reckless disregard by it of its obligations and duties under this Agreement.",2.0
"(E) make no representations, warranties or guarantees to customers or to the trade with respect to the specifications, features or capabilities of the Wireless Products that are inconsistent with the warranties and disclaimers included in or with the Wireless Products",2.0
"11. Entire Agreement. This Agreement contains the entire agreement between the parties hereto and supersedes any and all prior agreements, arrangements, or understandings between the parties relating to the subject matter of this Agreement. No oral understandings, statements, promises, or inducements contrary to the terms of this Agreement exist. No representations, warranties, covenants, or conditions express or implied, other than as set forth herein, have been made by any party.",2.0
"8.2 Limitation on Damages In no event shall either party be liable for any special, incidental, or consequential damages arising out of or in connection with this Agreement or the performance thereof. FNW's liability for any breach of this Agreement shall be strictly limited to refunding to Sponsor that portion of any consideration paid by Sponsor for which Sponsor has not received the rights granted to it herein.",3.3
"18. Limitations of Liability. EXCEPT AS PROVIDED IN PARAGRAPH 15, WGT'S LIABILITY(WHETHER IN CONTRACT, WARRANTY, TORT (INCLUDING NEGLIGENCE WHETHER ACTIVE, PASSIVE, IMPUTED), PRODUCT LIABILITY, STRICT LIABILITY OR OTHER THEORY) UNDER THIS AGREEMENT OR WITH REGARD TO ANY PRODUCT OR OTHER ITEMS FURNISHED UNDER THIS AGREEMENT WILL IN NO EVENT EXCEED THE COMPENSATION PAID TO WGT CONCERNING SUCH PRODUCT UNDER THIS AGREEMENT.",3.7
"5.4. Notwithstanding any other provision of this Agreement, each party's total liability in respect of damages under this Agreement, any regulation or common law shall be limited to the sum of all amounts received from Client in terms of this Agreement; provided, however, that this limitation shall not apply with respect to any claims arising out of or relating to clause 6 (Inventions and Proprietary Information), indemnification obligations or damages arising from a party's gross negligence or willful misconduct. 5.5. Neither Party shall be liable to the other Party in respect of any indirect loses or damaged, pure economic nature, loss of profits or income howsoever arising.",4.0
"5. Sponsor's Maximum Obligation; Indemnification. Racing represents to the Sponsor that the Sponsor's aggregate obligation hereunder will not exceed the amount of the sponsorship fee set forth in Section 3 hereof (or such lesser amount as is payable by the Sponsor in the event that this Agreement is terminated pursuant to Section 14 hereof), plus, if applicable, collection costs that may be reasonably incurred by Racing in a legal proceeding to collect all or any part thereof (the Maximum Obligation). Racing agrees to indemnify the Sponsor and its officers, directors, agents and employees and to hold them harmless from any loss, claim, cost, damage or liability in excess of the Maximum Obligation which (i) the Sponsor shall incur as a result of this Agreement, or (ii) arises from any failure by Racing to perform any of its obligations hereunder.",3.7
"The parties agree that PageMaster Corporation shall not be liable for service interruptions in the telecommunications industry, capacity constraints or related problems, or for any act or omission of any other entity furnishing products or services to PageMaster Corporation. PageMaster Corporations' liability shall in no event exceed an amount equivalent to the amounts received by PageMaster Corporation hereunder.",4.0
