clause_text,rating
"5.4. Notwithstanding any other provision of this Agreement, each party's total liability in respect of damages under this Agreement, any regulation or common law shall be limited to the sum of all amounts received from Client in terms of this Agreement; provided, however, that this limitation shall not apply with respect to any claims arising out of or relating to clause 6 (Inventions and Proprietary Information), indemnification obligations or damages arising from a party's gross negligence or willful misconduct. 5.5. Neither Party shall be liable to the other Party in respect of any indirect loses or damaged, pure economic nature, loss of profits or income howsoever arising.",4.7
"10. INDEMNITIES. omitted WITHOUT AFFECTING STRICT PRODUCT LIABILITY UNDER MANDATORY APPLICABLE LAW, SECTION 10, OR THE RESPECTIVE OBLIGATIONS OF THE PARTIES UNDER THE CONFIDENTIAILITY AGREEMENT AND EXCEPT FOR BREACHES ASSOCIATED WITH THE UNAUTHORIZED USE OF INTELLECTUAL PROPERTY, IN NO EVENT SHALL EITHER PARTY BE LIABLE TO THE OTHER PARTY FOR SPECIAL, INCIDENTAL, CONSEQUENTIAL, PUNITIVE OR TORT DAMAGES, INCLUDING WITHOUT LIMITATION, ANY DAMAGES RESULTING FROM LOSS OF USE, LOSS OF DATA, LOSS OF PROFITS OR LOSS OF BUSINESS ARISING OUT OF OR IN CONNECTION WITH THE MATTERS CONTEMPLATED BY THIS AGREEMENT, WHETHER OR NOT A PARTY HAS BEEN ADVISED OF THE POSSIBILITY OF SUCH DAMAGES. omitted 11.3. Liability Cap. Without affecting Section 10 or the respective obligations of the parties under the Confidentiality Agreement and except for any liability (i) relating to any breach associated with the unauthorized use of Intellectual Property, (ii) arising from the intentional breach or willful misconduct of a party, or (iii) arising from the non-compliance with any mandatory applicable law or regulation, the total aggregate liability of one party to another party for any claim relating to any breach of this Agreement (or any Purchase Order or other agreement entered into in connection with this Agreement) (a Claim) shall be limited to the aggregate amount of the purchase prices paid by Distributor to Accuray for Products pursuant to this Agreement (or any Purchase Order or other Agreement entered into in connection with this Agreement) during the twelve calendar months preceding the date of the notification to the other party of such Claim less any amounts paid or payable in respect of any other Claim of which the other party was notified during such twelve month period.",4.7
"12.3 Limitations on Liability. SUBJECT TO AND WITHOUT LIMITING THE INDEMNIFICATION OBLIGATIONS OF EACH PARTY WITH RESPECT TO THIRD PARTY ACTIONS UNDER SECTIONS 12.1 AND 12.2, AND EXCEPT WITH RESPECT TO LIABILITY ARISING FROM BREACH OF SECTION 9.1 (Confidentiality) BY A PARTY, NO PARTY OR ANY OF ITS AFFILIATES WILL BE LIABLE TO THE OTHER PARTY OR ITS AFFILIATES UNDER ANY CONTRACT, WARRANTY, NEGLIGENCE, TORT, STRICT LIABILITY OR OTHER LEGAL OR EQUITABLE THEORY FOR ANY SPECIAL, INDIRECT, INCIDENTAL, PUNITIVE, MULTIPLIED OR CONSEQUENTIAL DAMAGES, OR OTHER DAMAGES FOR LOSS OF PROFIT, SALES OR FEES, ARISING OUT OF OR IN CONNECTION WITH THIS AGREEMENT OR ITS SUBJECT MATTER. FURTHER, SUBJECT TO AND WITHOUT LIMITING THE INDEMNIFICATION OBLIGATIONS OF EACH PARTY WITH RESPECT TO THIRD PARTY ACTIONS UNDER SECTIONS 12.1 AND 12.2, AND EXCEPT WITH RESPECT TO LIABILITY ARISING FROM BREACH OF SECTION 9.1 BY A PARTY OR ARISING FROM THE GROSS NEGLIGENCE OR WILLFUL MISCONDUCT OF A PARTY, EACH PARTY'S AGGREGATE LIABILITY TO THE OTHER PARTY FOR ALL CASES AND CONTROVERSIES ARISING OUT OF THE SUBJECT MATTER OF THIS AGREEMENT, REGARDLESS OF THE CAUSE OF ACTION AND WHETHER BROUGHT IN CONTRACT, TORT (INCLUDING NEGLIGENCE), STRICT LIABILITY OR OTHERWISE, WILL BE LIMITED TO $. THE AMOUNT OF SERVICE FEES AND MILESTONE PAYMENTS PAID OR DUE TO COMPANY UNDER THIS AGREEMENT WILL NOT BE INCLUDED IN THE CALCULATION OF SUCH AGGREGATE LIABILITY AMOUNT.",3.7
"8.4 Limitation of Damages. IN NO EVENT SHALL EITHER PARTY BE LIABLE FOR ANY CONSEQUENTIAL, SPECIAL OR PUNITIVE DAMAGES OR LOST PROFITS ARISING UNDER OR RELATING TO THIS AGREEMENT. Except in the event of (i) a Party's gross negligence or willful misconduct and/or (ii) a Party's breach of its confidentiality obligation, the total liability of one Party to the other Party (and its Affiliates) arising out of or in connection with this Agreement or the Products, whether in contract, tort (including negligence), statute or otherwise, shall, to the maximum extent permitted by Applicable Law, be limited to the amount of revenues it receives under this Agreement.",4.0
"9. LIMITATIONS OF LIABILITY. 9.1 No Consequential or Indirect Damages. NEITHER PARTY SHALL BE LIABLE UNDER OR IN CONNECTION WITH THIS AGREEMENT FOR INDIRECT, INCIDENTAL, CONSEQUENTIAL, LIQUIDATED, SPECIAL OR EXEMPLARY DAMAGES OR PENALTIES, INCLUDING WITHOUT LIMITATION, LOSSES OF BUSINESS, REVENUE OR ANTICIPATED PROFITS, REGARDLESS OF WHETHER SUCH DAMAGE WAS FORESEEABLE AND WHETHER LICENSOR HAS BEEN ADVISED OF THE POSSIBILITY OF SUCH DAMAGES. 9.2 Cap on Monetary Damages. EACH PARTY'S LIABILITY ARISING OUT OF OR RELATED TO THIS AGREEMENT WILL NOT EXCEED AN AMOUNT EQUAL TO THE AGGREGATE AMOUNTS PAID OR PAYABLE TO LICENSOR IN THE TWELVE (12) MONTHS PRECEDING THE COMMENCEMENT OF THE CLAIM. 9.3 Exceptions. The provisions of Section 9.1 and Section 9.2 will not apply to limit the Licensee's indemnification obligations under Section 8.2, or in the case of Licensee's gross negligence or wilful misconduct.",3.7
"10.4 Limitations on Liability. (a) Except in the event of (i) Third Party Claims subject to a Party's indemnification obligations pursuant to Section 10.1, (ii) Third Party Claims subject to a Party's indemnification obligations pursuant to Section 10.2, (iii) the gross negligence, fraud or willful misconduct of a Party or its Personnel, (iv) a Party's willful breach of this Agreement, (v) a breach of Section 13 or (vi) customer liabilities pursuant to, and subject to the limitations set forth in, Section 2.5(e), neither Party's aggregate liability to the other Party (or its Personnel that are indemnitees under Section 10.1 or Section 10.2, as applicable) under this Agreement for the initial twelve (12) month period immediately following the Effective Date, and for any twelve (12) month period thereafter during the Term, shall exceed, on a cumulative basis, the amount that is one and one half (112) times the aggregate amounts paid or payable pursuant to this Agreement in the preceding twelve (12) month period preceding the loss date by Customer to Manufacturer but solely with respect to the supply hereunder of Product (or Products) for which such corresponding liability arose (the Affected Products) and not any other Products (or if, as of the time the liability arises, this Agreement has not been in effect for twelve (12) months, then the amounts paid or payable by Customer to Manufacturer hereunder during the period from the Effective Date until such time the liability arises, shall be annualized to a full twelve (12) months but solely with respect to the supply hereunder of the Affected Product(s) and not any other Products). (b) NOTWITHSTANDING ANY OTHER PROVISION OF THIS AGREEMENT TO THE CONTRARY, EXCEPT FOR DAMAGES OR CLAIMS ARISING OUT OF (I) A BREACH OF SECTION 13 OF THIS AGREEMENT, (II) CUSTOMER LIABILITIES PURSUANT TO, AND SUBJECT TO THE LIMITATIONS SET FORTH IN, SECTION 2.5(E), (III) A PARTY'S OR ITS PERSONNEL'S GROSS NEGLIGENCE, FRAUD OR WILLFUL MISCONDUCT, (IV) A PARTY'S WILLFUL BREACH OF THIS AGREEMENT, OR (V) A PARTY'S INDEMNIFICATION OBLIGATION WITH RESPECT TO THIRD PARTY CLAIMS UNDER SECTION 10.1 OR SECTION 10.2, IN NO EVENT SHALL EITHER PARTY BE LIABLE TO THE OTHER PARTY OR ANY INDEMNIFIED PARTY HEREUNDER FOR ANY CONSEQUENTIAL DAMAGES, SPECIAL DAMAGES, INCIDENTAL OR INDIRECT DAMAGES, LOSS OF REVENUE OR PROFITS, DIMINUTION IN VALUE, DAMAGES BASED ON MULTIPLE OF REVENUE OR EARNINGS OR OTHER PERFORMANCE METRIC, LOSS OF BUSINESS REPUTATION, PUNITIVE AND EXEMPLARY DAMAGES OR ANY SIMILAR DAMAGES ARISING OR RESULTING FROM OR RELATING TO THIS AGREEMENT, WHETHER SUCH ACTION IS BASED ON WARRANTY, CONTRACT, TORT (INCLUDING NEGLIGENCE OR STRICT LIABILITY) OR OTHERWISE.",2.0
"13. Limitation of Liability. EXCEPT WITH REGARD TO A PARTY'S BREACH OF SECTION 9, GROSS NEGLIGENCE, WILLFUL MISCONDUCT AND INDEMNIFICATION OBLIGATIONS RELATED TO THIRD PARTY CLAIMS PURSUANT TO SECTION 12, EACH PARTY'S ENTIRE LIABILITY UNDER THIS AGREEMENT WILL IN NO EVENT EXCEED THREE TIMES (3X) THE TOTAL VALUE OF THE WORK ORDER UNDER WHICH THE CLAIM AROSE. NOTWITHSTANDING ANYTHING TO THE CONTRARY CONTAINED IN THIS AGREEMENT, NEITHER PARTY SHALL BE LIABLE TO THE OTHER PARTY FOR INCIDENTAL, INDIRECT, CONSEQUENTIAL OR SPECIAL DAMAGES OR FOR ANY DAMAGES ARISING OUT OF OR IN CONNECTION WITH ANY LOSS OF PROFIT, INTERRUPTION OF SERVICE OR LOSS OF BUSINESS OR ANTICIPATORY PROFITS, EVEN IF A PARTY OR ITS AFFILIATES HAVE BEEN APPRISED OF THE LIKELIHOOD OF SUCH DAMAGES OCCURRING, IN EACH CASE ARISING IN CONNECTION WITH ANY DEFAULT OR BREACH OF OBLIGATIONS UNDER THIS AGREEMENT OR ANY ATTACHMENTS HERETO.",2.0
"c. LIMITATIONS ON LIABILITY/NO INJUNCTIVE RELIEF. EXCEPT IN CASES OF GROSS NEGLIGENCE, WILLFUL MISCONDUCT OR FRAUD, INDEMNIFICATION CLAIMS UNDER SECTION 5 OR BREACHES OF SECTION 2 (TRADEMARKS), 8 (CONFIDENTIALITY), OR 9 (NO AGENCY RELATIONSHIP), IN NO EVENT SHALL EITHER PARTY OR ITS OFFICERS, DIRECTORS, OR EMPLOYEES BE LIABLE TO THE OTHER PARTY IN CONNECTION WITH THE SUBJECT MATTER HEREOF, FOR ANY SPECIAL, INDIRECT, CONSEQUENTIAL OR PUNITIVE DAMAGES OF ANY KIND, LOST PROFITS OR LOST REVENUE, WHETHER ARISING IN CONTRACT, TORT, NEGLIGENCE, STATUTE, OR OTHERWISE, EVEN IF ADVISED OF THE POSSIBILITY THEREOF. IN NO EVENT SHALL THE NON-BREACHING PARTY BE ENTITLED TO EQUITABLE OR INJUNCTIVE RELIEF OF ANY KIND.",2.0
"11.6 No Consequential Damages. EXCEPT TO THE EXTENT ARISING (A) FROM A PARTY'S BREACH OF ARTICLE 10 (CONFIDENTIALITY), (B)  (E) FROM A PARTY'S FRAUD, GROSS NEGLIGENCE OR WILLFUL MISCONDUCT OR (F) IN CONNECTION WITH A PARTY'S INDEMNIFICATION OBLIGATIONS UNDER ARTICLE 12 (INDEMNIFICATION; INSURANCE), IN NO EVENT WILL EITHER PARTY BE LIABLE TO THE OTHER PARTY FOR ANY LOST PROFITS, INDIRECT, SPECIAL, INCIDENTAL, EXEMPLARY OR CONSEQUENTIAL DAMAGES OF ANY KIND ARISING OUT OF OR IN CONNECTION WITH THIS AGREEMENT, HOWEVER CAUSED AND ON ANY THEORY OF LIABILITY (WHETHER IN CONTRACT, TORT (INCLUDING NEGLIGENCE), STRICT LIABILITY OR OTHERWISE). THE LIMITATIONS SET FORTH IN THIS SECTION WILL APPLY EVEN IF A PARTY HAS BEEN ADVISED OF THE POSSIBILITY OF SUCH DAMAGES, AND NOTWITHSTANDING ANY FAILURE OF ESSENTIAL PURPOSE OF ANY LIMITED REMEDY. 11.7 Liability Limit. TO THE GREATEST EXTENT PERMITTED UNDER APPLICABLE LAW, IN NO EVENT WILL A PARTY'S AGGREGATE LIABILITY (ABOVE AMOUNTS ACTUALLY PAID OR REIMBURSED BY SUCH PARTY'S INSURER (TO THE EXTENT NOT SELF-INSURED)) FOR A CLAIM ARISING OUT OF OR RELATED TO THIS AGREEMENT UNDER ANY LEGAL OR EQUITABLE THEORY, INCLUDING BREACH OF CONTRACT, TORT (INCLUDING NEGLIGENCE), STRICT LIABILITY, AND OTHERWISE EXCEED , EXCEPT THAT (A) SUCH LIMITATION SHALL NOT APPLY TO (I) A PARTY'S BREACH OF ARTICLE 10 (CONFIDENTIALITY), , (V) A PARTY'S FRAUD, GROSS NEGLIGENCE OR WILLFUL MISCONDUCT OR (VI) A PARTY'S INDEMNIFICATION OBLIGATIONS UNDER ARTICLE 12 (INDEMNIFICATION; INSURANCE) AND (B) SUCH LIMITATION ON LIABILITY SHALL NOT INCLUDE ANY AMOUNTS ACCRUED AND ACTUALLY OWED PURSUANT TO THE TERMS OF THIS AGREEMENT.",2.0
"9.0 Limitation of Liability 9.1 IBM's Limitation of Liability Circumstances may arise where, because of a default on IBM's part or other liability, Customer is entitled to recover damages from IBM. Regardless of the basis on which Customer is entitled to claim damages from IBM (including fundamental breach, negligence, misrepresentation, or other contract or tort claim), IBM is liable for no more than: a. indemnification payments as provided in Section 8.1; b. damages for bodily injury (including death) and damage to real property and tangible personal property; and c. the amount of any other actual direct damages, up to the greater of $100,000 or the charges paid by Customer to IBM for the Services in the twelve (12) months immediately preceding the accrual of the first claim related to the Services. The foregoing limit also applies to any of IBM's Affiliates and Subcontractors. It is the cumulative maximum for which IBM and its Affiliates and Subcontractors are collectively responsible. Under no circumstances is IBM, its Affiliates or its Subcontractors liable for any of the following: 1. third party claims against Customer for damages (other than those expressly provided in Subsections 9.1(a) and 9.1(b)); or 2. loss of, or damage to, Customer's or any other entity's records or data. 9.2 Customer's Limitation of Liability Circumstances may arise where, because of a default on Customer's part or other liability, IBM is entitled to recover damages from Customer. Regardless of the basis on which IBM is entitled to claim damages from Customer (including fundamental breach, negligence, misrepresentation, or other contract or tort claim), Customer is liable for no more than: a. Indemnification payments as provided in Section 8.2; b. damages for bodily injury (including death) and damage to real property and tangible personal property; and c. the amount of any other actual direct damages, up to the greater of $100,000 or the charges paid by Customer to IBM for the Services in the twelve (12) months immediately preceding the accrual of the first claim related to the Services. The foregoing limit also applies to any of Customer's Affiliates. It is the cumulative maximum for which Customer and its Affiliates are collectively responsible. Under no circumstances is Customer or its Affiliates liable for any third party claims against IBM for damages (other than those expressly provided in Subsections 9.2(a) and 9.2(b)). 10.0 Disclaimer of Consequential Damages a. In no event will either party be liable to the other for special, incidental, or indirect damages or for any consequential damages (including lost profits or savings), even if they are informed of the possibility; provided that this Section 10 does not apply to Customer's failure to pay any amounts owing to IBM under this Agreement (including amounts owing for Services that would have been rendered but for Customer's breach of this Agreement).",2.0
"ARTICLE XIII CONFIDENTIALITY omitted ARTICLE XIV MISCELLANEOUS Section 14.1 Notices. All notices, consents, and other communications between the parties under or regarding this Agreement shall be in writing and shall be sent to the recipient's address set forth in this section. Such communications shall be deemed to have been received on the date actually received. Section 10.5 Limitations. (a) EXCEPT IN CONNECTION WITH A BREACH OF ARTICLE XIII OF THIS AGREEMENT AND WITH THE EXCEPTION OF THE INDEMNIFICATION OBLIGATIONS OF THE PARTIES UNDER ARTICLE X, IN NO EVENT SHALL EITHER PARTY BE LIABLE TO THE OTHER PARTY OR ANY OTHER PERSON OR ENTITY FOR ANY INDIRECT, INCIDENTAL, CONSEQUENTIAL, SPECIAL, PUNITIVE, EXEMPLARY, OR EXTRA-CONTRACTUAL DAMAGES OF ANY KIND WHATSOEVER ARISING FROM OR CONNECTED WITH THIS AGREEMENT, INCLUDING, BUT NOT LIMITED TO, LOST PROFITS, LOST REVENUES, OR LOSS OF BUSINESS, REGARDLESS OF LEGAL THEORY, WHETHER OR NOT FORESEEABLE, EVEN IF EITHER PARTY HERETO HAS BEEN ADVISED OF THE POSSIBILITY OR PROBABILITY OF SUCH DAMAGES AND EVEN IF THE REMEDIES OTHERWISE PROVIDED BY THIS AGREEMENT FAIL OF THEIR ESSENTIAL PURPOSE. THE REMEDIES PROVIDED BY THIS AGREEMENT AND THE PROVISIONS OF THIS AGREEMENT ALLOCATE THE RISKS OF THIS AGREEMENT BETWEEN THE PARTIES, SOME OF WHICH MAY BE UNKNOWN OR UNDERMINABLE. THESE LIMITATIONS ARE A MATERIAL INDUCEMENT FOR THE PARTIES TO THIS AGREEMENT TO ENTER INTO THIS AGREEMENT, AND THE PARTIES TO THIS AGREEMENT HAVE RELIED UPON THESE PROVISIONS IN DETERMINING WHETHER OR NOT TO ENTER INTO THIS AGREEMENT. (b) EXCEPT IN CONNECTION WITH A BREACH OF ARTICLE XIV HEREUNDER, AND WITH THE EXCEPTION OF THE INDEMNIFICATION OBLIGATIONS OF THE PARTIES UNDER ARTICLE X, THE AGGREGATE TOTAL LIABILITY OF EITHER PARTY TO THE OTHER PARTY AND TO ALL OTHER PERSONS AND ENTITIES UNDER THIS AGREEMENT SHALL UNDER NO CIRCUMSTANCES EXCEED THE AMOUNT OF THE NET REVENUE RECEIVED BY NCM PURSUANT TO SECTION 7.2 OF THIS AGREEMENT DURING THE FIVE (5) YEAR PERIOD PRECEDING SUCH LIABILITY, LESS IN ANY CASE THE AGGREGATE OF ANY AMOUNTS PAID BY NCM HEREUNDER ON ACCOUNT OF PREVIOUS EVENTS OF LIABILITY.",2.0
"4.2 PRODUCT INDEMNITY. PivX will indemnify, defend and hold Detto and its subsidiaries (each, an Indemnified Party), harmless from and against any and all claims, losses, costs, liabilities and expenses (including reasonable attorneys' fees), arising as a result of or in connection with any claim that Qwik-Fix Pro or Documentation infringes any intellectual property right of a third party provided: (i) the Indemnified Party promptly gives written notice of any claim to PivX; (ii) the Indemnified Party provides any assistance which PivX may reasonably request for the defense of the claim (with reasonable out of pocket expenses paid by PivX); and (iii) PivX has the right to control of the defense or settlement of the claim, provided, however, that the Indemnified Party shall have the right to participate in, but not control, any litigation for which indemnification is sought with counsel of its own choosing, at its own expense. Additionally, if an injunction or order issues restricting the use or distribution of any of Qwik-Fix Pro or Documentation, or if PivX determines that Qwik-Fix Pro or Documentation are likely to become the subject of a claim of infringement or violation of any proprietary right of any third party, PivX shall in its discretion and, at its option (a) procure the right to continue using, reproducing, and distributing Qwik-Fix Pro and Documentation; (b) replace or modify Qwik-Fix Pro and Documentation so that they become noninfringing, provided such modification or replacement does not materially alter or affect the specifications for or the use or operation of Qwik-Fix Pro; require return of Qwik-Fix Pro to PivX and refund any licensing fees relating to the future use of Qwik-Fix Pro. omitted 4.4 INDEMNIFICATION. Detto shall indemnify and hold PivX harmless from and against any and all damages, liabilities, costs and expenses (including reasonable attorney's fees) which PivX incurs as a result of any claim based on any breach of any representation or warranty, covenant or agreement by Detto under this Agreement or any breach of this Agreement by Detto; provided: (i) that PivX promptly gives written notice of any claim to Detto; (ii) at Detto's expense, PivX provides reasonable assistance which Detto may reasonably request for the defense of the claim; and (iii) Detto has the right to control the defense or settlement of the claim, provided, however, that PivX shall have the right to participate in, but not control, any litigation for which indemnification is sought with counsel of its own choosing, at its own expense. 4.3 LIMITATION OF LIABILITY. EXCEPT FOR PIVX'S OBLIGATIONS UNDER SECTION 4.2, IN NO EVENT SHALL PIVX'S OR ITS LICENSORS' LIABILITY TO DETTO OR ANY THIRD PARTY ARISING OUT OF THIS AGREEMENT EXCEED THE TOTAL AMOUNT ACTUALLY RECEIVED BY PIVX HEREUNDER DURING THE PREVIOUS SIX (6) MONTHS. IN NO EVENT SHALL ANY PARTY OR PIVX'S LICENSORS BE LIABLE TO ANOTHER PARTY OR ANY THIRD PARTY FOR LOSS OF DATA, COSTS OF PROCUREMENTS OF SUBSTITUTE GOODS OR SERVICES OR ANY INDIRECT, INCIDENTAL, SPECIAL, OR CONSEQUENTIAL DAMAGES UNDER ANY CAUSE OF ACTION, EVEN IF SUCH PARTY HAS BEEN ADVISED OF THE POSSIBILITY OF SUCH DAMAGES. THIS LIMITATION SHALL APPLY NOTWITHSTANDING ANY FAILURE OF AN ESSENTIAL PURPOSE OF ANY LIMITED REMEDY PROVIDED HEREIN.",2.0
"8 INDEMNIFICATION. 8.1 By Commerce One. Commerce One shall indemnify, defend and hold harmless Corio and its Customers from any and all damages, liabilities, costs and expenses (including reasonable attorneys' fees) incurred by Corio or its Customers arising out of any claim that the Software infringes any patent, copyright, trademark or trade right secret of a third party; omitted 9 LIMITATION OF LIABILITY. EXCEPT FOR LIABILITY ARISING UNDER SECTION 8 OF THIS AGREEMENT, IN NO EVENT SHALL EITHER PARTY'S LIABILITY ARISING OUT OF THIS AGREEMENT OR THE USE OR PERFORMANCE OF THE SOFTWARE EXCEED THE TOTAL AMOUNT ACTUALLY PAID BY CORIO HEREUNDER FOR THE TRANSACTION WHICH THE LIABILITY RELATES TO DURING THE TWELVE (12) MONTHS IMMEDIATELY PRIOR TO THE FILING OF THE CAUSE OF ACTION TO WHICH THE LIABILITY RELATES. EXCEPT FOR LIABILITY ARISING UNDER SECTION 8 OF THIS AGREEMENT, IN NO EVENT SHALL EITHER PARTY HAVE ANY LIABILITY TO THE OTHER PARTY FOR ANY LOST PROFITS OR COSTS OF PROCUREMENT OF SUBSTITUTE GOODS OR SERVICES, OR FOR ANY INDIRECT, SPECIAL OR CONSEQUENTIAL DAMAGES HOWEVER CAUSED AND UNDER ANY THEORY OF LIABILITY AND WHETHER OR NOT SUCH PARTY HAS BEEN ADVISED OF THE POSSIBILITY OF SUCH DAMAGE. THE PARTIES AGREE THAT THIS SECTION 9 REPRESENTS A REASONABLE ALLOCATION OF RISK.",2.0
"10.06. EXCEPT WITH RESPECT TO EACH PARTY'S INDEMNIFICATION OBLIGATIONS UNDER THIS AGREEMENT, (A) UNDER NO CIRCUMSTANCE AND UNDER NO LEGAL THEORY (TORT, CONTRACT, OR OTHERWISE), SHALL EITHER PARTY BE LIABLE TO THE OTHER PARTY FOR ANY LOST PROFITS, LOSS OF OPPORTUNITY OR OTHER SPECIAL, PUNITIVE, INDIRECT, OR CONSEQUENTIAL DAMAGES SUFFERED BY THE OTHER PARTY ARISING IN CONNECTION WITH THIS AGREEMENT; AND (B) THE MAXIMUM LIABILITY OF EACH PARTY IN ANY WAY RELATED TO THIS AGREEMENT SHALL NOT EXCEED $2,000,000.00 (EXCLUDING ANY AMOUNTS DUE AND PAYABLE PURSUANT TO SECTION 8 HEREUNDER).",2.0
"2.7 RESTRICTIONS. Corio may not copy, distribute, reproduce, use or allow access to the Software except as explicitly permitted under this Agreement, and Corio shall not, nor will it permit any third party to, modify, adapt, translate, prepare derivative works from, decompile, reverse engineer, disassemble or otherwise attempt to derive source code from the Software or any internal data files generated by the Software. 8 INDEMNIFICATION. omitted 9 LIMITATION OF LIABILITY. EXCEPT FOR LIABILITY ARISING UNDER SECTIONS 2.7, 8, 10 AND 12.3 OF THIS AGREEMENT, IN NO EVENT SHALL EITHER PARTY'S LIABILITY ARISING OUT OF OR RELATED TO THIS AGREEMENT OR THE USE OR PERFORMANCE OF THE SOFTWARE EXCEED THE TOTAL AMOUNT ACTUALLY PAID BY CORIO HEREUNDER FOR THE TRANSACTION WHICH THE LIABILITY RELATES TO DURING THE TWELVE (12) MONTHS IMMEDIATELY PRIOR TO THE CAUSE OF ACTION FIRST ARISING, EVEN IF IT IS A CONTINUOUS ONE, OR IN THE AGGREGATE, WITH RESPECT OF ALL CLAIMS ARISING OUT OF OR RELATED TO THIS AGREEMENT, THE TOTAL AMOUNT ACTUALLY PAID BY CORIO UNDER THIS AGREEMENT TO CHANGEPOINT. EXCEPT FOR LIABILITY ARISING UNDER SECTIONS 2.7, 8, 10 AND 12.3 OF THIS AGREEMENT, IN NO EVENT SHALL EITHER PARTY HAVE ANY LIABILITY TO THE OTHER PARTY FOR ANY LOST PROFITS OR COSTS OF PROCUREMENT OF SUBSTITUTE GOODS OR SERVICES, OR FOR ANY INDIRECT, INCIDENTIAL, SPECIAL OR CONSEQUENTIAL DAMAGES HOWEVER CAUSED AND UNDER ANY THEORY OF LIABILITY AND WHETHER OR NOT SUCH PARTY HAS BEEN ADVISED OF THE POSSIBILITY OF SUCH DAMAGE. THE PARTIES AGREE THAT THIS SECTION 9 REPRESENTS A REASONABLE ALLOCATION OF RISK. omitted 10 CONFIDENTIALITY. omitted 12.3 LICENSE.",2.0
"11.5 Limitation of Liability. EXCEPT WITH RESPECT TO DAMAGES THAT ARISE DUE TO A PARTY'S BREACH OF CONFIDENTIALITY (ARTICLE 12) OR INDEMNIFICATION OBLIGATIONS (ARTICLE 11), IN NO EVENT WILL EITHER PARTY BE LIABLE TO THE OTHER FOR CONSEQUENTIAL, INDIRECT, SPECIAL, EXEMPLARY OR PUNITIVE DAMAGES FOR ANY CAUSE OF ACTION, WHETHER IN CONTRACT, TORT OR OTHERWISE, INCLUDING LOST REVENUES, PROFITS OR BUSINESS OPPORTUNITIES ARISING OUT OF OR IN CONNECTION WITH THIS AGREEMENT, WHETHER OR NOT THE OTHER PARTY WAS OR SHOULD HAVE BEEN AWARE OF THE POSSIBILITY OF THESE DAMAGES. EXCEPT WITH RESPECT TO DAMAGES THAT ARISE DUE TO A PARTY'S BREACH OF CONFIDENTIALITY (ARTICLE 12) OR INDEMNIFICATION OBLIGATIONS (ARTICLE 11), THE LIABILITY OF EITHER PARTY UNDER THIS AGREEMENT (WHETHER BY REASON OF BREACH OF CONTRACT, TORT, OR OTHERWISE) WITH RESPECT TO A GIVEN CLAIM SHALL NOT EXCEED AN AMOUNT EQUAL TO .",2.0
"9.1 Limited Liability EXCEPT FOR LIABILITY ARISING FROM BREACHES OF A PARTY'S CONFIDENTIALITY OBLIGATIONS CONTAINED IN THE NON-DISCLOSURE CLAUSE IN SECTION 12.17 OF THE CHINA JV OPERATING AGREEMENT, BREACHES OF LICENSE GRANTS CONTAINED HEREIN, AND EXCEPT FOR AMOUNTS PAYABLE TO THIRD PARTIES TO FULFILL INDEMNITY OBLIGATIONS DESCRIBED IN ARTICLE 8, (A) IN NO EVENT SHALL ANY PARTY HAVE ANY LIABILITY TO THE OTHERS, OR TO ANY PARTY CLAIMING THROUGH OR UNDER THE OTHER, FOR ANY LOST PROFITS, ANY INDIRECT, INCIDENTAL, SPECIAL OR CONSEQUENTIAL DAMAGES OF ANY KIND IN ANY WAY ARISING OUT OF OR RELATED TO THIS AGREEMENT, HOWEVER CAUSED AND UNDER ANY THEORY OF LIABILITY, EVEN IF SUCH PARTY HAS BEEN ADVISED OF THE POSSIBILITY OF SUCH DAMAGES; AND (B) IN NO EVENT SHALL A PARTY'S CUMULATIVE LIABILITY ARISING OUT OF THIS AGREEMENT EXCEED THE AMOUNTS ACTUALLY PAID, PAYABLE, RECEIVED OR RECEIVABLE BY SUCH PARTY FOR THE PRODUCTS CONCERNED THEREWITH HEREUNDER PURSUANT TO THIS AGREEMENT DURING THE TWELVE (12) MONTHS PRIOR TO THE OCCURRENCE OF THE INITIAL EVENT FOR WHICH A PARTY RECOVERS DAMAGES HEREUNDER. THESE LIMITATIONS SHALL APPLY NOTWITHSTANDING ANY FAILURE OF ESSENTIAL PURPOSE OF ANY REMEDY. THE PARTIES ACKNOWLEDGE AND AGREE THAT THIS ARTICLE 9 IS AN ESSENTIAL ELEMENT OF THE BARGAIN AND ABSENT THIS ARTICLE 9 THE ECONOMIC AND OTHER TERMS OF THIS AGREEMENT WOULD BE SUBSTANTIALLY DIFFERENT.",2.0
