clause_text,rating
"4.2 PRODUCT INDEMNITY. PivX will indemnify, defend and hold Detto and its subsidiaries (each, an Indemnified Party), harmless from and against any and all claims, losses, costs, liabilities and expenses (including reasonable attorneys' fees), arising as a result of or in connection with any claim that Qwik-Fix Pro or Documentation infringes any intellectual property right of a third party provided: (i) the Indemnified Party promptly gives written notice of any claim to PivX; (ii) the Indemnified Party provides any assistance which PivX may reasonably request for the defense of the claim (with reasonable out of pocket expenses paid by PivX); and (iii) PivX has the right to control of the defense or settlement of the claim, provided, however, that the Indemnified Party shall have the right to participate in, but not control, any litigation for which indemnification is sought with counsel of its own choosing, at its own expense. Additionally, if an injunction or order issues restricting the use or distribution of any of Qwik-Fix Pro or Documentation, or if PivX determines that Qwik-Fix Pro or Documentation are likely to become the subject of a claim of infringement or violation of any proprietary right of any third party, PivX shall in its discretion and, at its option (a) procure the right to continue using, reproducing, and distributing Qwik-Fix Pro and Documentation; (b) replace or modify Qwik-Fix Pro and Documentation so that they become noninfringing, provided such modification or replacement does not materially alter or affect the specifications for or the use or operation of Qwik-Fix Pro; require return of Qwik-Fix Pro to PivX and refund any licensing fees relating to the future use of Qwik-Fix Pro. omitted 4.4 INDEMNIFICATION. Detto shall indemnify and hold PivX harmless from and against any and all damages, liabilities, costs and expenses (including reasonable attorney's fees) which PivX incurs as a result of any claim based on any breach of any representation or warranty, covenant or agreement by Detto under this Agreement or any breach of this Agreement by Detto; provided: (i) that PivX promptly gives written notice of any claim to Detto; (ii) at Detto's expense, PivX provides reasonable assistance which Detto may reasonably request for the defense of the claim; and (iii) Detto has the right to control the defense or settlement of the claim, provided, however, that PivX shall have the right to participate in, but not control, any litigation for which indemnification is sought with counsel of its own choosing, at its own expense. 4.3 LIMITATION OF LIABILITY. EXCEPT FOR PIVX'S OBLIGATIONS UNDER SECTION 4.2, IN NO EVENT SHALL PIVX'S OR ITS LICENSORS' LIABILITY TO DETTO OR ANY THIRD PARTY ARISING OUT OF THIS AGREEMENT EXCEED THE TOTAL AMOUNT ACTUALLY RECEIVED BY PIVX HEREUNDER DURING THE PREVIOUS SIX (6) MONTHS. IN NO EVENT SHALL ANY PARTY OR PIVX'S LICENSORS BE LIABLE TO ANOTHER PARTY OR ANY THIRD PARTY FOR LOSS OF DATA, COSTS OF PROCUREMENTS OF SUBSTITUTE GOODS OR SERVICES OR ANY INDIRECT, INCIDENTAL, SPECIAL, OR CONSEQUENTIAL DAMAGES UNDER ANY CAUSE OF ACTION, EVEN IF SUCH PARTY HAS BEEN ADVISED OF THE POSSIBILITY OF SUCH DAMAGES. THIS LIMITATION SHALL APPLY NOTWITHSTANDING ANY FAILURE OF AN ESSENTIAL PURPOSE OF ANY LIMITED REMEDY PROVIDED HEREIN.",2.0
"5. Sponsor's Maximum Obligation; Indemnification. Racing represents to the Sponsor that the Sponsor's aggregate obligation hereunder will not exceed the amount of the sponsorship fee set forth in Section 3 hereof (or such lesser amount as is payable by the Sponsor in the event that this Agreement is terminated pursuant to Section 14 hereof), plus, if applicable, collection costs that may be reasonably incurred by Racing in a legal proceeding to collect all or any part thereof (the Maximum Obligation). Racing agrees to indemnify the Sponsor and its officers, directors, agents and employees and to hold them harmless from any loss, claim, cost, damage or liability in excess of the Maximum Obligation which (i) the Sponsor shall incur as a result of this Agreement, or (ii) arises from any failure by Racing to perform any of its obligations hereunder.",2.0
"8. Limitation of Liability. (a) In the absence of gross negligence, bad faith or willful misconduct on its part, Agent shall not be liable for any action taken, suffered or omitted by it or for any error of judgment made by it in the performance of its duties under this Agreement. In no event will Agent be liable for special, indirect, incidental, consequential or punitive losses or damages of any kind whatsoever (including but not limited to lost profits), even if Agent has been advised of the possibility of such losses or damages and regardless of the form of action. Any liability of Agent will be limited in the aggregate to an amount equal to twenty four (24) times the monthly administrative fee to be paid by Client as set forth in Exhibit B hereto. (b) If any question or dispute arises with respect to the proper interpretation of this Agreement or Agent's duties hereunder, Agent shall not be required to act or be held liable or responsible for its failure or refusal to act until the question or dispute has been (i) judicially settled (and Agent may, if it deems it advisable, but shall not be obligated to, file a suit in interpleader or for a declaratory judgment for such purpose) by a final judgment of a court of competent jurisdiction that is binding on all parties interested in the matter and is no longer subject to review or appeal, or (ii) settled by a written document in form and substance satisfactory to Agent and executed by Client. For such purpose, Agent may, but shall not be obligated to, require the execution of such a document.",2.0
"21. Limitation of Damages Chase shall have no liability for any indirect, incidental, special or consequential damages or any loss of revenue or profits arising under or with respect to this Agreement or the Affiliate Program, regardless of whether Chase has been advised of the possibility of such damages. Further, Chase's aggregate liability arising under or with respect to this Agreement or the Affiliate Program shall in no event exceed the total Commissions paid or payable by Chase to Affiliate under this Agreement.",2.0
"LIMITATION OF LIABILITY i-on will not be liable under any circumstances for any lost profits or other consequential damages, even if i-on has been advised as to the possibility of such damages. i-on's liability for damages to the Customer for any cause whatsoever, regardless of the form of action, and whether in contract or in tort, including negligence, shall be limited to one (1) month's fees and the remaining portion of any prepaid fees.",2.0
"Company is not liable for incidental, special or consequential damages for any reason (including loss of data or other business or property damage), even if foreseeable or if MA or Customer has advised of such a claim. Company's liability shall not exceed the fees that MA has paid under this Agreement. MA agrees that the pricing for the services would be substantially higher but for these limitations.",2.0
"8.5 Limitation of Liability. NO PARTY WILL BE LIABLE TO THE OTHER PARTY IN TORT, CONTRACT OR UNDER ANY OTHER LEGAL THEORY FOR ANY CONSEQUENTIAL, INDIRECT, INCIDENTAL, PUNITIVE OR SPECIAL LOSS OR DAMAGES ARISING OUT OF THIS AGREEMENT, EVEN IF APPRISED OF THE LIKELIHOOD OF SUCH DAMAGES OCCURRING. IN NO EVENT WILL IMNTV'S LIABILITY TO DISTRIBUTOR UNDER THIS AGREEMENT EXCEED THE AMOUNT ACTUALLY DUE TO IMNTV HEREIN.",2.0
"13. LIMITATION OF LIABILITIES 13.1 Limitation of Liabilities. IN NO EVENT SHALL JRVS'S LIABILITY ARISING OUT OF THIS AGREEMENT EXCEED THE AMOUNT RECEIVED BY JRVS FROM THE DISTRIBUTOR HEREUNDER FOR THE PRODUCT GIVING RISE TO THE LIABILITY. IN NO EVENT SHALL JRVS BE LIABLE FOR COSTS OF PROCUREMENT OF SUBSTITUTE PRODUCTS OR SERVICES, LOST PROFITS OR ANY CONSEQUENTIAL, SPECIAL, INCIDENTAL, OR INDIRECT DAMAGES, HOWEVER CAUSED AND ON ANY THEORY OF LIABILITY (INCLUDING NEGLIGENCE OR STRICT LIABILITY), ARISING OUT OF THIS AGREEMENT. THE DISTRIBUTOR ACKNOWLEDGES AND AGREES THAT THESE LIMITATIONS SHALL APPLY NOTWITHSTANDING ANY FAILURE OF ESSENTIAL PURPOSE OF ANY LIMITED REMEDY. 13.2 Limitation on Actions. NO ACTIONS, REGARDLESS OF FORM, ARISING OUT OF THIS AGREEMENT, MAY BE BROUGHT BY DISTRIBUTOR MORE THAN ONE (1) YEAR AFTER THE CAUSE OF ACTION HAS ARISEN.",2.0
"In no event shall DGT be liable for consequential or incidental damages arising from any breach or breaches of this Agreement. No action, whether in contract or tort (including negligence), or otherwise arising out of or in connection with this Agreement, may be brought by Dolphin more than six months after the cause of action has occurred. DGT's total liability, whether under the express or implied terms of this Agreement, in tort (including negligence), or at common law, for any loss or damage suffered by Dolphin, whether direct, indirect or special, or any other similar or like damage that may arise or does arise from any breaches of this Agreement by DGT and its Directors, Officers or agents, shall be limited to the amount of the cost of the products.",2.0
"6.5 Limitation of Liability: In no event shall either party be liable to the other party for incidental, indirect, special and consequential or punitive damages, including without limitation any claims for damages based upon lost profits or lost business opportunity. Except for the obligation of indemnity as set forth in Section 6.1 (c) with respect to claims by third parties for personal injury, illness or death (but not including property damage) resulting from the manufacture of the Product by BPC, aggregate damages for which ADMA shall be liable to Sanofi Pasteur hereunder, including without limitation costs of Source Plasma yield loss and/or rejected Batches, shall not exceed . All claims by Sanofi Pasteur for breach or default under this Agreement shall be brought within  year after the cause of action comes into existence or otherwise shall be waived. This limitation of liability will not apply for damages that result from the gross negligence or the willful misconduct of a Party.",2.0
"11. LIMITATIONS OF LIABILITY. 11.1 GENERAL. EXCEPT FOR DAMAGES FOR WHICH A PARTY IS RESPONSIBLE PURSUANT TO ITS INDEMNIFICATION OBLIGATIONS SET FORTH IN SECTION 10 ABOVE, EACH PARTY SPECIFICALLY DISCLAIMS ALL LIABILITY FOR AND SHALL IN NO EVENT BE LIABLE FOR ANY INCIDENTAL, SPECIAL, INDIRECT OR CONSEQUENTIAL DAMAGES, EXPENSES, LOST PROFITS, LOST SAVINGS, INTERRUPTIONS OF BUSINESS OR OTHER DAMAGES OF ANY KIND OR CHARACTER WHATSOEVER ARISING OUT OF OR RELATED TO THIS AGREEMENT OR RESULTING FROM THE MANUFACTURE, HANDLING. MARKETING, SALE, DISTRIBUTION OR USE OF LICENSED PRODUCT REGARDLESS OF THE FORM OF ACTION, WHETHER IN CONTRACT, TORT, STRICT LIABILITY OR OTHERWISE, EVEN IF SUCH PARTY WAS ADVISED OF THE POSSIBILITY OF SUCH DAMAGES. FUSION SHALL HAVE NO REMEDY, AND CPDC SHALL HAVE NO LIABILITY, OTHER THAN AS EXPRESSLY SET FORTH IN THIS AGREEMENT. EXCEPT FOR DAMAGES FOR WHICH A PARTY IS RESPONSIBLE PURSUANT TO ITS INDEMNIFICATION OBLIGATIONS SET FORTH IN SECTION 10 ABOVE, NO ACTION, REGARDLESS OF FORM, ARISING OUT OF OR RELATED TO THIS AGREEMENT MAY BE BROUGHT BY EITHER PARTY MORE THAN  AFTER SUCH PARTY HAS KNOWLEDGE OF THE OCCURRENCE THAT GAVE RISE TO THE CAUSE OF SUCH ACTION. 11.2 CPDC MAXIMUM LIABILITY. NOTWITHSTANDING ANY OTHER TERM HEREIN, OR ANY TERM OF THE MASTER SERVICES AGREEMENT. CPDC'S MAXIMUM LIABILITY TO FUSION UNDER THIS SUPPLY AGREEMENT FOR ANY REASON WHATSOEVER, INCLUDING, WILL NOT EXCEED . 12. Non-Solicitation. During the term and for a period of  thereafter, neither party shall solicit, induce, encourage or attempt to induce or encourage any employee of the other party with whom such party has had direct contact to terminate his or her employment with such other party or to breach any other obligation to such other party. This section is not meant to encompass general solicitations such as may be found in newspaper advertisements and the like and the interviewing or hiring of any person who responds to a general solicitation",2.0
"10.8 PPI Liability Limitation. Any and all liability of PPI to EKR howsoever arising in respect of this Agreement, the Transition Services and Inventory Agreement or the Supply Agreement and their performance, in contract tort or otherwise, shall be limited (except for death or personal injury caused by the negligence of PPI or its employees while acting in the course of their employment) to  US Dollars ($); provided however that such limitation shall not apply to the extent that EKR or any EKR Indemnified Party is required to pay in excess of such amount to a third party in respect of a final judgment or order obtained by the third party or as a result of PPI's breach of Section 7.2.12 of the Supply Agreement. 10.9 EKR Liability Limitation. Any and all liability of EKR to PPI howsoever arising in respect of this Agreement, the Transition Services and Inventory Agreement or the Supply Agreement and their performance in contract tort or otherwise shall be limited (except for death or personal injury caused by the negligence of EKR or its employees while acting in the course of their employment, and except in relation to any specified payment, lump sum, milestone or royalty payment unpaid) to  US Dollars ($); provided however that such limitation shall not apply to the extent that PPI or any PPI Indemnified Party is required to pay in excess of such amount to a third party in respect of a final judgment or order obtained by the third party. 10.10 Limitation of Damages. Notwithstanding anything contained in this Agreement or the Transition Services and Inventory Agreement or the Supply Agreement in no circumstance shall either Party be liable to the other in contract, tort (including negligence or breach of statutory duty) or otherwise howsoever, and whatever the cause thereof, for any special, indirect or consequential loss or damage of any nature whatsoever except in the cases of fraud or intentional misconduct or in the case of PPI as a result of PPI's breach of Section 7.2.12 of the Supply Agreement.",4.0
"Section 6.1 Indemnification of Operator by Owner. Owner shall indemnify, defend and hold harmless Operator, its officers, directors, employees, shareholders, Affiliates and agents (each, a Operator Indemnitee) from and against any and all Indemnifiable Losses asserted against or suffered by any Operator Indemnitee arising out of any Third Party Claims against a Operator Indemnitee to the extent arising out of or in connection with (i) Owner's breach of its representations, warranties or covenants in this Agreement, (ii) the negligent or intentional acts or omissions of Owner or its subcontractors, agents or employees or others under Owner's control or (iii) a breach by Owner of its obligations hereunder, provided that Owner shall have no obligation to indemnify Operator for any negligence, fraud or willful misconduct of any Operator Indemnitee or the breach by Operator of any Operator Indemnitee of its covenants and warranties under this Agreement or any other Transaction Document. Section 6.2 Indemnification of Owner by Operator. Operator shall indemnify, defend and hold harmless Owner, its members, managers, officers, directors, employees, Affiliates and agents (each, an Owner Indemnitee) from and against any and all Indemnifiable Losses asserted against or suffered by any Owner Indemnitee arising out of any Third Party Claims against an Owner Indemnitee to the extent arising out of or in connection with (i) Operator's breach of its representations, warranties or covenants in this Agreement, (ii) the negligent or intentional acts or omissions of Operator or its subcontractors, agents or employees or others under Operator's control or (iii) a breach by Operator of its obligations hereunder; provided that Operator shall have no obligation to indemnify Owner for any negligence, fraud or willful misconduct of any Owner Indemnitee, the breach by Owner of its covenants and warranties under this Agreement or the inability to utilize any tax benefits (for the avoidance of doubt, the Grant is not considered a tax benefit). omitted Maximum Liability means, with respect to Operator, the aggregate Residual Value of the Portfolio as of such date, and with respect to Owner, One Million Dollars ($1,000,000); provided that a reduction in the Maximum Liability of Operator shall never result in a requirement for Owner or any Owner Indemnitee to return any money to Operator. Maximum Liability will be determined on an aggregate basis between this Agreement and the MESPA. omitted ARTICLE 7 LIMITATIONS ON LIABILITY Section 7.1 Aggregate Limit of Liability. (a) Notwithstanding anything to the contrary in this Agreement, in no event shall a Party be liable to the other Party for an aggregate amount in excess of the Maximum Liability; provided that such limitation of liability shall not apply to any liability that is the result of (i) gross negligence, fraud or willful misconduct of a Party, (ii) a Third Party Claim, (iii) the failure to pay the Service Fees (which amount shall not be included in calculating Owner's Maximum Liability), (iv) a claim of Owner against BE or Operator in the event of any breach, default or misrepresentation of any representation and warranty or covenant set forth in Section 8.2(e) or (v) a claim of Owner against BE or Operator under Section 2.8. Subject always to the Maximum Liability limitations set forth in the preceding sentence, except for damages specifically provided for in this Agreement or in connection with the indemnification for damages awarded to a third party under a Third Party Claim, damages hereunder are limited to direct damages, and in no event shall a Party be liable to the other Party, and the Parties hereby waive claims, for (a) indirect, punitive, special or consequential damages or loss of profits; provided, however, that the loss of profits language set forth in this Section 7.1 shall not be interpreted to exclude from Indemnifiable Losses any claim, demand, suit, loss, liability, damage, obligation, payment, cost or expense (including the cost and expense of any action, suit, proceeding, assessment, judgment, settlement or compromise relating thereto and reasonable attorneys' fees and reasonable disbursements in connection therewith) that would otherwise be included in the definition of Indemnifiable Losses because they result from a reduction in the profits of Owner, Diamond State Generation Holdings, LLC, or both, and (b) losses or liabilities incurred by the officers, directors, members, managers, partners, shareholders or Affiliates of such Party (unless on behalf of Owner). (b) Notwithstanding anything to the contrary provided herein, in no event shall Operator be liable under this Agreement (including with respect to its obligations related to the Facility Service Warranty, the Power Performance Warranty or Warranty Specification) for (i) any failure of or damage to the Bloom System or (ii) any obligations on the part of Operator (including internal rate of return or other financial metrics or any obligations to deliver power to Owner or service the Bloom System) caused by or arising from (A) Owner's (as opposed to Operator or Operator's Affiliate or subcontractor acting as operator under this Agreement) failure to properly protect the Bloom Systems from vandalism or other third- party's actions or omissions, (B) Owner's (as opposed to Operator or Operator's Affiliate or subcontractor acting as operator under this Agreement) failure to use the specified input fuel; (C) Owner's (as opposed to Operator or Operator's Affiliate or subcontractor acting as operator under this Agreement) removal of any safety devices, (D) Force Majeure Events, (E) installation, operation, repair or modification of the Bloom Systems by anyone other than Operator or Operator's authorized agents or Owner's operator acting pursuant to a operating and maintenance agreement provided such operator is acting in accordance with Prudent Electrical Practices and information or materials supplied by Operator or its Affiliates, or (F) any defect in construction materials or workmanship of the BOF or any deficiency in design of the BOF by BE, provided that the exclusions in this clause (F) shall not extend to any warranty claim to the extent caused by or arising from (1) any defect in construction materials or workmanship of the BOF or (2) any deficiency in design of the BOF by BE, in each case during the period while the MESPA Section 8.2(b) Warranty is in effect. OPERATOR SHALL NOT BE RESPONSIBLE FOR DAMAGE TO BLOOM SYSTEMS OR THEIR COMPONENTS DUE TO THEIR OPENING OR MODIFICATION BY OWNER OR ANYONE OTHER THAN OPERATOR, OPERATOR'S AFFILIATE, THE SERVICE PROVIDER OR SUBCONTRACTOR, ACTING AS OPERATOR UNDER THIS AGREEMENT, ANY PERSON ACTING AS AN OPERATOR UNDER THIS AGREEMENT (OR ANY SUCCESSOR AGREEMENT TO THIS AGREEMENT) OR ANY OF SUCH PERSON'S REPRESENTATIVES. Except for Owner's payment of money to Operator, and subject to Section 9.19 hereof, neither Party shall be liable under any circumstance, nor be deemed to be in breach of this Agreement, for any delay or failure in performance or interruption of service resulting from any Force Majeure Event, or any other cause or causes which are beyond such Party's reasonable control. Section 7.2 No Duplication of Claims. Notwithstanding anything to the contrary in this Agreement, the Parties acknowledge and agree that the limitations of liability set forth in this Agreement and the MESPA are to be calculated on an aggregate basis taking into account all claims (if any) made under this Agreement and the MESPA.",3.3
"8.8 Should orders for Equipment and Software exceed Airspan's available inventory, Airspan will allocate its available inventory and make deliveries on a basis that Airspan deems equitable, in its sole discretion, and without liability to Distributor on account of the method of allocation chosen or its implementation. In any event, Airspan shall not be liable for any direct, indirect, consequential, or special losses or damages (including, but not limited to, loss of income or profit and loss of data) that may be suffered by the Distributor or by any other person for failure to deliver or for any delay or error in delivery of Equipment or Software for any reason whatsoever. omitted 13.6 Airspan shall not be liable to Distributor for damages of any kind, including incidental or consequential damages, on account of the termination of this agreement in accordance with this section 13. Airspan shall not be liable to Distributor on account of termination or expiration of this Agreement for reimbursement or damages for loss of goodwill, prospective profits, or anticipated orders, or on account of any expenditures, investments, leases, or commitments made by either party, or for any other reason whatsoever based upon or growing out of such termination or expiration. Airspan will recognize payments due to Distributor for orders received up to ninety (90) days after the termination or expiration of this Agreement. omitted 16.1 WITHOUT PREJUDICE TO SECTION 16.4, NEITHER Airspan, NOR ANY OF ITS OFFICERS, DIRECTORS, EMPLOYEES, AGENTS, REPRESENTATIVES, SHAREHOLDERS, OR AFFILIATES (Airspan AND SUCH OTHER PERSONS, THE Airspan PARTIES), SHALL HAVE ANY LIABILITY TO DISTRIBUTOR FOR LOSS OF PROFITS, INCOME, REVENUE OR DATA, OR INCIDENTAL, CONSEQUENTIAL, INDIRECT OR PUNITIVE DAMAGES OR LOSSES, ARISING FROM OR IN CONNECTION WITH THIS AGREEMENT, ANY PURCHASE ORDER PLACED PURSUANT TO THIS AGREEMENT OR ANY OTHER COLLATERAL CONTRACT, OR FROM OR IN CONNECTION WITH THE EQUIPMENT OR THE SOFTWARE OR THE USE THEREOF OR THE INABILITY TO USE THEM EITHER SEPARATELY OR IN COMBINATION WITH OTHER EQUIPMENT OR SOFTWARE, OR FROM ANY OTHER CAUSE, WHETHER CAUSED BY NEGLIGENCE, BREACH OF CONTRACT, STRICT LIABILITY, BREACH OF WARRANTY, ON GROUNDS OF FAILURE OF ESSENTIAL PURPOSE OR OTHERWISE. 16.2 Without prejudice to Sections 16.3 and 16.4, the liability of the Airspan Parties, taken as a whole, for each event or series of connected events arising out of or in connection with this Agreement, any purchase order placed pursuant to this Agreement, or any other collateral contract, or from or in connection with the Equipment or Software or the use thereof, or the inability to use them either separately or in combination with other equipment or software, or from any other cause, whether caused by negligence, breach of contract, strict liability, breach of warranty, on grounds of failure of essential purpose, or otherwise, shall in no circumstance exceed the total amount payable by Distributor to Airspan under this Agreement for the provision of the Equipment or Software which gave rise to the loss or damage or in connection with which the loss or damage was incurred. 16.3 Airspan Parties, taken as a whole, shall be liable for physical damage to Distributor's property resulting from Airspan's negligence under or in connection with this Agreement up to a maximum aggregate amount of one million US Dollars (US$1,000,000). And Distributor, taken as a whole, shall be liable for physical damage to Airspan's property resulting from Distributor's negligence under or in connection with this Agreement up to a maximum aggregate amount of one million US Dollars (US$1,000,000). 16.4 Nothing in this Agreement shall exclude or in any way limit Airspan liability for death or personal injury caused by its negligence.",3.3
